"DOI","Link","Abstract","EID"
"10.1002/prep.201700171","https://www.scopus.com/inward/record.uri?eid=2-s2.0-85033221642&doi=10.1002%2fprep.201700171&partnerID=40&md5=593f0202ce2f6c821cc243d107060e52","The Spray Flash Evaporation (SFE) process invented and developed at the NS3E laboratory allows obtaining different nanosized explosives (TNT, RDX, CL-20…). This process is based on the very fast evaporation of the solvent due to the drastic modification of pressure and temperature leading to the crystallization of the molecules present in solution into nanometric or submicrometric particles. Here, we show the possibility to prepare pure HMX (Octahydro-1,3,5,7-tetranitro-1,3,5,7-tetrazocine) or HMX based composites at the nanoscale using this process. This study mainly focuses on the size, morphology and crystallographic phases obtained for HMX and HMX/TNT composites depending on the experimental conditions (temperature, pressure, solution concentration…) used during the elaboration. For this purpose, the results obtained from scanning electron microscopy, X-ray diffraction and Raman spectroscopy are discussed. © 2017 Wiley-VCH Verlag GmbH & Co. KGaA, Weinheim","2-s2.0-85033221642"
"10.1007/s12127-017-0221-z","https://www.scopus.com/inward/record.uri?eid=2-s2.0-85026832279&doi=10.1007%2fs12127-017-0221-z&partnerID=40&md5=9753252afeed510c67071492daf34e6c","An approach using method validation (MV) parameters, otherwise known as analytical figures of merit was combined with electrospray ionization high performance ion mobility spectrometry (ESI-HPIMS) to describe an approach for evaluating drugs and explosives analysis in the field. MV parameters such as reduced mobility (Ko), conditional reduced mobility (Kc), resolving power (Rp), theoretical plates (N), linearity, accuracy, precision, limit of detection (LOD), limit of quantitation (LOQ), repeatability, range, and reporting limit were investigated and developed for eleven drugs and six explosives. Our investigation estimated resolving power at 66 ± 0.64 for the ESI-HPIMS used. The LOD’s calculated ranged from 0.45–2.97 ng of material electrosprayed into the ESI-HPIMS. The LOQ’s calculated falls in the range 4.11–8.63 ng of material electrosprayed into the ESI-HPIMS. The key findings from this investigation were the following: Kc proves to be a measure of the identity of an explosive or drug ion; a parameter that may be applied to help aid IMS devices when detecting drugs and explosives. MV parameters, especially, Kc, introduced in this study is an effective parameter for establishing a unique identity of a drug or explosive. A control chart is an effective way to monitor the performance of an instrument and may be a useful tool for establishing reliability of confirmatory data in forensic investigations. MV parameters may be a reliable, accurate and unique identification marker for target drugs and explosives capable of differentiating these substances from false positive responses. © 2017, Springer-Verlag GmbH Germany.","2-s2.0-85026832279"
"10.1021/acs.langmuir.7b01927","https://www.scopus.com/inward/record.uri?eid=2-s2.0-85027264508&doi=10.1021%2facs.langmuir.7b01927&partnerID=40&md5=2b0d2d5890ed80ddcca11b9ecab86f2f","Two simple and novel gelators (G-P with pyridine and G-B with benzene) with different C-4 substitution groups on naphthalimide derivatives have been designed and characterized. Two gelators could form organogels in some solvents or mixed solvents. The self-assembly processes of G-P in a mixed solvent of acetonitrile/H2O (1/1, v/v) and G-B in acetonitrile were studied by means of electron microscopy and spectroscopy. The organogel of G-P in the mixed solvent of acetonitrile/H2O (1/1, v/v) formed an intertwined fiber network, and its emission spectrum had an obvious blue shift compared with that of solution. By contrast, the organogel of G-B in acetonitrile formed a straight fiber, and its emission had an obvious red shift compared with that of solution. G-P and G-B were employed in detecting nitroaromatic compounds because of their electron-rich property. G-P is more sensitive and selective toward 2,4,6-trinitrophenol (TNP) compared with G-B. The sensing mechanisms were investigated by 1H NMR spectroscopic experiments and theoretical calculations. From these experimental results, it is proposed that electron transfer occurs from the electron-rich G-P molecule to the electron-deficient TNP because of the possibility of complex formation between G-P and TNP. The G-P molecule could detect TNP in water, organic solvent media, as well as using test strips. It is worth mentioning that the organogel G-P can not only detect TNP but also remove TNP from the solution into the organogel system. © 2017 American Chemical Society.","2-s2.0-85027264508"
"10.1002/pola.28382","https://www.scopus.com/inward/record.uri?eid=2-s2.0-84991087113&doi=10.1002%2fpola.28382&partnerID=40&md5=e7d0990ea3402f81cc31f86c4d7010ec","Four novel aggregation-induced emission (AIE)-active poly(acrylates), in which AIE-active luminogens 3,6-bis(1,2,2-triphenylvinyl)carbazole (BTPC) and bis(4-(1,2,2-triphenylvinyl)phenyl)amine (BTPPA) were linked to the polymer backbone via a flexible alkyl chain, were synthesized in high yields. Spectrofluorometric analysis of polymer nano-aggregates in tetrahydrofuran/water revealed that PTPPA-based polymers gave more sensitive fluorescence response to nitro-aromatics including 2,4,6-trinitrotoluene than BTPC-based polymers. Paper probes were also fabricated for solid-state detection of explosives. © 2016 Wiley Periodicals, Inc. J. Polym. Sci., Part A: Polym. Chem. 2017, 55, 672–681. © 2016 Wiley Periodicals, Inc.","2-s2.0-84991087113"
"10.1016/j.cplett.2017.11.026","https://www.scopus.com/inward/record.uri?eid=2-s2.0-85034669950&doi=10.1016%2fj.cplett.2017.11.026&partnerID=40&md5=3526c6b09075c53d0cf512bed491c606","Pyrolysis products of ammonium perchlorate (NH4ClO4) at 483 K were monitored on line and in situ via single photon photoionization reflectron time-of-flight spectrometry (PI-ReTOF-MS) in the photon energy range of 9.00–17.50 eV. The photoionization efficiency curves (PIE) of the subliming product molecules were collected and allowed for detection of three class of products containing chlorine, nitrogen, and oxygen including atoms and free radicals. These results suggest a new insight into possible low-temperature decomposition pathways of NH4ClO4. © 2017 Elsevier B.V.","2-s2.0-85034669950"
"10.1007/s10973-017-6665-x","https://www.scopus.com/inward/record.uri?eid=2-s2.0-85029606427&doi=10.1007%2fs10973-017-6665-x&partnerID=40&md5=b6fc8cb119431083428e01c4597c8c96","The thermal decomposition behaviors of 2,4,6-Trinitrotoluene (TNT) and 1-methoxy-2,4-dinitro-benzene (DNAN) were studied by using a NETSCH company accelerating rate calorimetry. Hazard indicators such as onset temperature, adiabatic temperature rise, initial self-heat temperature, maximum self-heating rate, and time-to-maximum temperature rise rate have been determined directly. The kinetic parameters, such as the activation energy (Ea) and the pre-exponential factor (A) were studied from the measured self-heating rate data by assuming order reaction. © 2017, Akadémiai Kiadó, Budapest, Hungary.","2-s2.0-85029606427"
"10.1109/ICEEE2.2017.7935846","https://www.scopus.com/inward/record.uri?eid=2-s2.0-85025586185&doi=10.1109%2fICEEE2.2017.7935846&partnerID=40&md5=f1031136f1ca89f18c9056cee34ad87a","In this study; a system has been designed to detect buried explosives which contains ferromagnetic materials by means of magnetic anomalies caused by these explosives. In order to detect these materials, a passive measurement technique is used differently from conventional one. For this purpose, a sensor network having 32 nodes of TE100 fluxgate magnetic field sensors has been designed. This sensor network has been moved in a mechanism having cartesian motion capability, and data have been taken from 6 different test samples. Two-dimensional-gray scale images have been created for the obtained 32×25 size data. © 2017 IEEE.","2-s2.0-85025586185"
"10.1016/j.tsf.2016.10.056","https://www.scopus.com/inward/record.uri?eid=2-s2.0-85019101208&doi=10.1016%2fj.tsf.2016.10.056&partnerID=40&md5=ec29aba5b7a1a05233256c5227f0e943","Our work deals with thin films of silver phthalocyanine (AgPc) combined with gold, palladium and silver nanoparticles. These films were applied for the indirect detection of 2-nitrotoluene which is used as a taggant in explosives. The films were deposited by an Organic Molecular Evaporation and a DC magnetron sputtering. The growth of metallic nanoparticles was continuously monitored through in-situ resistance measurements to detect the percolation threshold. We varied composition of the nanoparticles, their amount (the sputtered equivalent thickness was in the range from 1 to 50 nm) and also the geometry of sensing layers: geometry i) bottom AgPc + top nanoparticles, geometry ii) top AgPc layer + bottom nanoparticles. The sensors with geometry i) exhibited good recovery capabilities, those with geometry ii) seemed to better preserve phthalocyanine sensing properties. For the best combination, the AgPc(50 nm)/Au(10 nm) sensor, its dc-response rose to the value of 373 for 190 ppm of 2-nitrotoluene. This suggests that 2-nitrotoluene can be detected in the sub-ppm concentrations by these films. © 2016 Elsevier B.V.","2-s2.0-85019101208"
"10.1039/c8ta02857e","https://www.scopus.com/inward/record.uri?eid=2-s2.0-85047209828&doi=10.1039%2fc8ta02857e&partnerID=40&md5=14d2c3232819898fdfa56e040045c26f","Through an ion exchange method, the composite 1⊃HPTS was prepared via the introduction of HPTS (8-hydroxy-1,3,6-pyrenetrisulfonicacid trisodium salt) into the channels of the compound [Zn(TIPA)(NO3-)2(H2O)]·5H2O (1). 1⊃HPTS exhibits durable dual-emission performance of both blue and yellow-green emission, and could act as a two-signal platform in aqueous solution. 1⊃HPTS exhibits ultrahigh sensitive response to a wide range of nitro-compounds, including nitroaromatics, aliphatic nitro-explosives and nitro-containing antibiotics. Particularly, 1⊃HPTS displays ratiometric fluorescence response against RDX. To the best of our knowledge, this is the first MOF-based probe with such an effect for the identification of RDX among luminescent materials. Moreover, the film based on the 1⊃HPTS sample shows high sensitivity towards 4-TNP vapor with good reusability. We also demonstrated that the detection of nitro-compounds using 1⊃HPTS predominantly involved photo-induced electron transfer and fluorescence resonance energy transfer. © The Royal Society of Chemistry.","2-s2.0-85047209828"
"10.1039/c7ra13536j","https://www.scopus.com/inward/record.uri?eid=2-s2.0-85041732447&doi=10.1039%2fc7ra13536j&partnerID=40&md5=7dc523f6bc0ec9ab791a405fcc59b862","The novel polytriphenylamines derivatives PTPA1-TPE and PTPA2-TPE with TPE as side groups and bis(tert-butyl)-TPE in the backbones have been successfully synthesized via Yamamoto-type coupling under microwave heating. The incorporation of TPE units in the backbones and side-chains endows the polymers with a distinct AIE effect and high fluorescence quantum yields in the solid state. Meanwhile, nitroaromatic explosive detection based on dispersed, electron-rich PTPA1-TPE and PTPA2-TPE nanoaggregates in THF/water was carried out. Both of them show high sensitivity towards the TNT analyte, with a maximum Stern-Volmer quenching constant Ksv of up to 8.3 × 104 M-1. In addition, the paper strip test demonstrates the promising practical application of the polymers as solid state sensors towards PL-based nitroaromatic explosive detection. © 2018 The Royal Society of Chemistry.","2-s2.0-85041732447"
"10.1021/acs.cgd.6b01808","https://www.scopus.com/inward/record.uri?eid=2-s2.0-85017118529&doi=10.1021%2facs.cgd.6b01808&partnerID=40&md5=1ec004093eaf575ae40809ac76750b0b","Three inorganic-organic hybrid open frameworks based on heterometallic cluster building blocks, formulated as Cd2Cs3(NDC)3(OAc)(DMA)2(H2O) (1), [NH2(CH3)2]2·Cd2Mg(NDC)4·Gx (2), and [NH2(CH3)2]3·Cd2K(NDC)4·Gx (3) (H2NDC = 2,6-naphthalenedicarboxylic acid, G = guest solvent molecule), were synthesized under solvothermal conditions. Compound 1 has a pillared layered structure featuring inorganic hcb-type layers with 14-ring windows and simultaneously exhibits a 3D open framework constructed from two types of heterometallic clusters, i.e., {Cd2Cs2O18} and {CdCs4O18}, and the NDC2- ligand. Compounds 2 and 3 are constructed from linear trinuclear {Cd2M} (M = Mg and K) building blocks and the NDC2- ligand, featuring 1D square channels with rld-z topology. Of the three heterometallic hybrid open frameworks, compounds 1 and 2 exhibited strong blue-light emission due to the presence of fluorescent organic ligands in the anionic frameworks, and more importantly, their strong fluorescence could be selectively quenched toward the nitro explosive picric acid (PA). Mechanism study has demonstrated that the high fluorescence quenching selectivity of both hybrid materials toward PA might be due to resonance energy transfer and photoinduced electron transfer processes. © 2017 American Chemical Society.","2-s2.0-85017118529"
"10.1016/j.molstruc.2016.12.015","https://www.scopus.com/inward/record.uri?eid=2-s2.0-85002781666&doi=10.1016%2fj.molstruc.2016.12.015&partnerID=40&md5=3b104f198b954c8ceaf581e24826d276","In this study, a Raman spectrum of TNT was characterized through experiments and simulated using 22 hybrid density functional theory (DFT) methods. Among the different hybrid DFT methods, it was found that the most accurate simulation results of the Raman shift frequency were calculated by the O3LYP method. However, the deviations of the calculated Raman frequencies from the experimental value showed no dependency on the abilities of the DFT methods in recovering the correlation energy. The accuracies of the DFT methods in predicting the Raman bands are probably determined by the numerical grid and convergence criteria for optimizations of each DFT method. It was also decided that the prominent Raman shift 1362 cm−1 is mainly caused by symmetric stretching of the 4-nitro groups. Findings of this study can facilitate futuristic development of more effective surface enhanced Raman spectroscopy/scattering (SERS) substrates for explosive characterization and detection. © 2016 Elsevier B.V.","2-s2.0-85002781666"
"10.1080/05704928.2017.1312427","https://www.scopus.com/inward/record.uri?eid=2-s2.0-85027997682&doi=10.1080%2f05704928.2017.1312427&partnerID=40&md5=339b62d108e06eff3021260e2ba7bc77","Plasmonic nanoparticles (NPs) have been reviewed herein for their fascinating optical properties in a wide spectral range and for their various applications. The surface plasmon resonance (SPR) bands of metal NPs can be tuned from visible to near infrared region by varying the shape of the metal NPs. As a result, the tuning of the SPR band over a spectral range is possible by making plasmonic NPs of different shapes. This review emphasizes fundamental studies of plasmonic NPs and nanocomposites with well-defined and controlled shapes that have several analytical applications such as molecular detection and determination in different fields. This review describes how oxidative etching and kinetic control can be utilized to manipulate the shape and optical properties of NPs. This review also describes the specific examples of the sensing applications of the localized surface plasmon resonance studies in which the researchers use both wavelength shift and surface-enhanced Raman scattering sensing to detect the molecules of chemical and biological relevance. The review ends with a perspective of the field, identifying the main challenges to be overcome and suggesting areas where the most promising developments are likely to happen in future. © 2017 Taylor & Francis Group, LLC.","2-s2.0-85027997682"
"10.1002/prep.201600046","https://www.scopus.com/inward/record.uri?eid=2-s2.0-85017595397&doi=10.1002%2fprep.201600046&partnerID=40&md5=6006ebd6ea097428015190545489aa33","In Brazil, automated teller machine (ATM) has become a major target of theft incursions toward explosion. Efficient analysis of explosives residues on suspect banknotes is a serious issue in forensic labs, and guide to the crime solution. Easy ambient sonic-spray ionization mass spectrometry (EASI-MS) is shown to be a simple and selective screening tool to identify peroxide explosives on real banknotes collected from ATM explosion. Analyses were carried out directly on the banknotes surfaces without any sample preparation, identifying triacetone triperoxide (TATP) and diacetone diperoxide (DADP). Homemade EASI source was coupled to ultrahigh-resolution and ultrahigh accuracy FT-ICR MS and revealed the ion of m/z 245 correspondent to sodiated TATP [C9H18O6Na]+ and the ion of m/z 171 related to sodiated DADP [C6H12O4Na]+, ions that is the sodiated DADP and the ions of m/z 173 and 189 related to [C6H14O4Na]+ and [C6H14O4K]+, respectively, which are associated to chemical markers of TATP domestic route synthesis. EASI source coupled to a single quadrupole mass spectrometer provides an intelligent and simple way to identify the explosives TATP, DADP and its domestic synthesis markers. © 2017 Wiley-VCH Verlag GmbH & Co. KGaA, Weinheim","2-s2.0-85017595397"
"10.1117/12.2304507","https://www.scopus.com/inward/record.uri?eid=2-s2.0-85048046120&doi=10.1117%2f12.2304507&partnerID=40&md5=776aa83c81e9c8fdd49c9c9b4f377c10","The identification followed by avoidance or removal of explosive hazards in past and/or present conflict zones is a serious threat for both civilian and military personnel. This is a challenging task as variability exists with respect to the objects, their environment and emplacement context, to name a few factors. A goal is the development of automatic or human-in-the-loop sensor technologies that leverage signal processing, data fusion and machine learning. Herein, we explore the detection of side attack explosive hazards (SAEHs) in three dimensional voxel space radar via different shallow and deep convolutional neural network (CNN) architectures. Dimensionality reduction is performed by using multiple projected images versus the raw three dimensional voxel data, which leads to noteworthy savings in input size and associated network hyperparameters. Last, we explore the accuracy and interpretation of solutions learned via random versus intelligent network weight initialization. Experiments are provided on a U.S. Army data set collected over different times, weather conditions, target types and concealments. Preliminary results indicate that deep learning can perform as good as, if not better, than a skilled domain expert, even in light of limited training data with a class imbalance. © 2018 SPIE.","2-s2.0-85048046120"
"10.1039/c6qm00281a","https://www.scopus.com/inward/record.uri?eid=2-s2.0-85032703292&doi=10.1039%2fc6qm00281a&partnerID=40&md5=633c45923b7599bcffb8d84a5991c01e","A series of novel microporous polymer networks (MPNs) have been prepared from tetraphenylethene (TPE)-cored, multifunctional carbazole- or thiophene-based monomers by using chemical and electrochemical oxidative coupling methods. Octafunctional monomers lead to MPNs with a high degree of cross-linking and optimized specific surface areas (SBET) of up to 2200 m2 g-1. Aggregation-induced emission (AIE) activity of the monomers is demonstrated. The MPN films are tested for application in the chemical sensing of nitroaromatic analytes by fluorescence quenching. © 2018 the Partner Organisations.","2-s2.0-85032703292"
"10.1039/c7qi00495h","https://www.scopus.com/inward/record.uri?eid=2-s2.0-85040813968&doi=10.1039%2fc7qi00495h&partnerID=40&md5=008711461f265e857f418af7ccb63e07","The rapid detection of antibiotics and organic explosives has gradually garnered great attention, due to concerns about sustainability and the environment. In this work, a luminescent Tb-based metal organic gel (MOG(Tb) gel) was prepared by Al-based MOG induced in situ replacement of Al3+ with Tb3+. Remarkably, the strong emission of the post-synthesized MOG(Tb) xerogel can be quenched efficiently by using trace amounts of sulfamethazine (SMZ) and sulfadiazine (SDZ) even in the presence of other competing antibiotics. Furthermore, the MOG(Tb) xerogel has shown its application as a chemosensor for the highly selective detection of nitroaromatics such as 2,4-dinitrophenol (2,4-DNT) and 2,6-dinitrophenol (2,6-DNT). To further verify the recyclability of MOG(Tb), detection experiments were carried out with recovered xerogel to give a satisfactory result. © 2017 the Partner Organisations.","2-s2.0-85040813968"
"10.1109/JSEN.2017.2709331","https://www.scopus.com/inward/record.uri?eid=2-s2.0-85029210030&doi=10.1109%2fJSEN.2017.2709331&partnerID=40&md5=72b9d66496ba6c8ff3a4d919264f2734","In this paper, we present the design and development of a novel miniaturized multimodal photonic sensor, which can be configured dually as a photodetector in the absorptive mode and as a pyro-detector in the photonic sensor mode. In this paper, we have fabricated a polyvinyl alcohol (PVA) photoactive layer-based MEMS structure and analysed the effect of effective inter-electrode separation on the photoactive area of the photoactive film using the four quadrant metal-semiconductor polymer-metal (MSM) design on the photoresponsivity of this device in terms of photoconductive and the pyroelectric responses. Our analysis reveals that the interdigitated electrode configuration is best suited for photoconductive response while the cross-electrode configuration with large effective inter-electrode spacing is advantageous for pyroelectric measurement in the infrared region. Here, the unique design of this device offers the choice of electrode configurations that enables the utility of this device in various regions of the electromagnetic spectrum. In this regard, we demonstrate the optical detection of localized surface plasmon resonance of immobilized gold nanoparticle monolayer in the visible region, employing the absorptive mode and the detection of the spectroscopic signature of RDX and TNT molecules (134 μg/cm2) in the midinfrared region using photonic sensor mode. This paper paves a way for designing a low-cost PVA-based miniaturized sensor architectures with huge potential for on-chip real-time detections in various fields of scientific and commercial applications. © 2017 IEEE.","2-s2.0-85029210030"
"10.1021/acs.cgd.7b00131","https://www.scopus.com/inward/record.uri?eid=2-s2.0-85020277353&doi=10.1021%2facs.cgd.7b00131&partnerID=40&md5=fd4867ab5d84ee00c72d39c60fe7e1ce","One tetracarboxylate functionalized benzene-cored tetraphenylethene derivative was designed as a linker for construction of aggregation-induced emission (AIE) active metal-organic frameworks (MOFs), which exhibit the distinct AIE behavior. Two two-dimensional MOFs materials, MOF-1 and MOF-2, have been successfully synthesized by using the organic linker precursor. Photophysical studies reveal that both MOFs exhibit remarkable fluorescent properties with the absolute quantum yield as high as 43%. The high PL efficiency, good water stability, as well as the electron-donating nature of prepared MOF materials, allow us to explore their potentials in sensing applications for electron-deficient nitro explosives in aqueous media. Especially, water-stable MOF-2 exhibits superior sensitivity and selectivity toward 2,4,6-trinitrophenol (TNP) over other selected nitro analytes, including nitromethane, 2,3-dimethyl-dinitrobutane, nitrobenzene, 2,4,6-trinitrotoluene, 2,6-dinitrotoluene, 2,4-dinitrotoluene, 1,3-dinitrobenzene, with the detection limit for TNP as low as 0.49 μM (∼110 ppb). In virtue of its excellent detection efficiency, applicability in water and reusability, MOF-2 can be a promising fluorescent sensor material for the practical TNP sensing. © 2017 American Chemical Society.","2-s2.0-85020277353"
"10.1201/9781351073721","https://www.scopus.com/inward/record.uri?eid=2-s2.0-85052482930&doi=10.1201%2f9781351073721&partnerID=40&md5=584505c0b886d4176d87f5111c0018ae","The search for trace organic substances in complex organic and inorganic matrices is one of the most challenging tasks facing analytical chemists today. The presence of trace contaminants affects all aspects of our lives: the water and food we ingest, the air we breathe, the quality of the goods we produce, the environment in which we work and live—in short, our day-to-day health and security. The chemists’ ability to discern these trace contaminants, which in one form or other may signify a hazard to human welfare, has been largely due to the development of highly sensitive and selective analytical instruments. © 1992 by LEWIS PUBLISHERS, INC.","2-s2.0-85052482930"
"10.3390/s17081769","https://www.scopus.com/inward/record.uri?eid=2-s2.0-85026809414&doi=10.3390%2fs17081769&partnerID=40&md5=b67ab2ab4135b5e70712f5976500e7f7","We report a simple and inexpensive electrochemical assay using a custom built hand-held potentiostat for the identification of explosives. The assay is based on a wipe test and is specifically designed for use in the field. The prototype instrument designed to run the assay is capable of performing time-resolved electrochemical measurements including cyclic square wave voltammetry using an embedded microcontroller with parts costing roughly $250 USD. We generated an example library of cyclic square wave voltammograms of 12 compounds including 10 nitroaromatics, a nitramine (RDX), and a nitrate ester (nitroglycine), and designed a simple discrimination algorithm based on this library data for identification. © 2017 by the authors. Licensee MDPI, Basel, Switzerland.","2-s2.0-85026809414"
