"DOI","Link","Abstract","EID"
"10.1016/j.snb.2016.08.046","https://www.scopus.com/inward/record.uri?eid=2-s2.0-84982156760&doi=10.1016%2fj.snb.2016.08.046&partnerID=40&md5=77469f06b79868df64a24050a0530354","Photoluminescence quenching of organic thin films is a promising technique for the detection of vapors from explosives. The photoluminescence quenching response depends on the energetics of electron transfer from the photo-excited sensing material to the analytes, the vapor pressure of the analyte, and the diffusion process of the analytes in the sensing films. It is critical that the performance of a potential sensing material be evaluated in the solid-state with a range of analytes and across a range of vapor concentrations to ensure high sensitivities through non-contact sampling are achievable. We have investigated the photoluminescence quenching of three generations of carbazole-based dendrimers across a range of nitro-containing analyte vapor concentrations, including the TNT by-product 2,4-dinitrotoluene (DNT), and the tagging agent 2,3-dimethyl-2,3-dinitrobutane (DMNB). We show that the performance of all three dendrimer generations in the solid-state is near identical. Furthermore, we show that these dendrimers have a high affinity towards nitroaromatic compounds with parts per billion sensitivity, which makes them ideal for trace-level detection. © 2016 Elsevier B.V.","2-s2.0-84982156760"
"10.1002/cphc.201600767","https://www.scopus.com/inward/record.uri?eid=2-s2.0-84992432056&doi=10.1002%2fcphc.201600767&partnerID=40&md5=4b4dd8f53dc375dce1298b088333216d","Time-resolved quartz crystal microbalance with in situ fluorescence measurements are used to monitor the sorption of the nitroaromatic (explosive) vapor, 2,4-dinitrotoluene (DNT) into a porous pentiptycene-containing poly(phenyleneethynylene) sensing film. Correlation of the nitroaromatic mass uptake with fluorescence quenching shows that the analyte diffusion follows the Case-II transport model, a film-swelling-limited process, in which a sharp diffusional front propagates at a constant velocity through the film. At a low vapor pressure of DNT of ≈16 ppb, the analyte concentration in the front is sufficiently high to give an average fluorophore–analyte separation of ≈1.5 nm. Hence, a long exciton diffusion length is not required for real-time sensing in the solid state. Rather the diffusion behavior of the analyte and the strength of the binding interaction between the analyte and the polymer play first-order roles in the fluorescence quenching process. © 2016 Wiley-VCH Verlag GmbH & Co. KGaA, Weinheim","2-s2.0-84992432056"
"10.1021/acs.analchem.6b03618","https://www.scopus.com/inward/record.uri?eid=2-s2.0-85021176978&doi=10.1021%2facs.analchem.6b03618&partnerID=40&md5=4e22b8a2b0d70b406348e2384bd40b80","In this work, we report the development of one fluorescent carbazole-based oligomer 1-zinc(II) coordination nanofiber which enabled the detection of five classes of explosives, i.e., nitroaromatics (dinitrotoluene, DNT, and trinitrotoluene, TNT), aliphatic nitro-organics (2,3-dimethyl-2,3-dinitrobutane, DMNB), nitramines (cyclotrimethylenetrinitramine, RDX), nitro-esters (pentaerythritol tetranitrate, PETN), and black powder (sulfur). We demonstrate that the coordination of zinc ion with a carbazole-based oligomer 1 allows the formation of the Lewis acid-base complex between explosives and the nanofiber that enhances the electron-accepting ability of the nitro-based explosives and the binding interactions between the sensing nanofibers and explosives. Furthermore, the resulting nanofiber-based sensor exhibited highly sensitive fluorescence quenching when exposed to trace sulfur, thereby enabling the sensitive detection of black powder. Herein, we present a new fluorescent sensor for five classes of explosives, which represents an important advance toward a richer identification of threats. © 2016 American Chemical Society.","2-s2.0-85021176978"
"10.1007/s10895-016-1898-9","https://www.scopus.com/inward/record.uri?eid=2-s2.0-84982245314&doi=10.1007%2fs10895-016-1898-9&partnerID=40&md5=c0d0de096adc20b88939cd92b2eefd02","New pyrene and anthracene based copper complexes 4 and 7 respectively were designed, synthesized and characterized. The fluorescence behaviour of both 4 and 7 were evaluated towards nitro aromatics and anions. Both 4 and 7 possess high selectivity for the detection of well-known explosive picric acid (PA) by showing maximum fluorescence affinity. Furthermore, complex 4 showed similar sensing efficiency towards PA at different pH ranges. It was also used for real world applications, as illustrated by the very fast detection of PA from soil samples observed directly by naked eye. © 2016, Springer Science+Business Media New York.","2-s2.0-84982245314"
"10.1109/MSMW.2016.7538215","https://www.scopus.com/inward/record.uri?eid=2-s2.0-84987934448&doi=10.1109%2fMSMW.2016.7538215&partnerID=40&md5=51f08e84d4e906ae3713bbfd298ed790","The detection of explosives and illicit substances is a very important problem nowadays. Especially, improvised explosive devices (IEDs) manufactured from homemade explosive materials has become an issue of growing importance. In this work, recent developments in the field of time domain (TD) NMR and microwave/sub-THz detection of liquid substances are reviewed. It has been shown that both TD NMR and MW dielectric spectroscopy are potentially very effective techniques to detect content of concealed liquids. © 2016 IEEE.","2-s2.0-84987934448"
"10.1039/c7ra05844f","https://www.scopus.com/inward/record.uri?eid=2-s2.0-85026759577&doi=10.1039%2fc7ra05844f&partnerID=40&md5=2a2a8456e9813dfc3d449fb7791002c4","In this study, we propose a surface-enhanced Raman spectroscopy (SERS)-based method for the quantification of nitrite (NO2                             -) derived from the alkaline hydrolysis of explosive materials, octahydro-1,3,5,7-tetranitro-1,3,5,7-tetrazocine (HMX) and hexahydro-1,3,5-trinitro-1,3,5-triazine (RDX). For this purpose, samples were hydrolyzed and neutralized before SERS measurement. The SERS determination of nitrite was performed on the surface of 4-aminothiol-modified gold nanorods doped with silver nanoparticles. Due to the differential hydrolysis behaviour of HMX and RDX at different alkalinities and temperatures, these two nitramines could be separately determined with SERS. Calibration curves were obtained for HMX and RDX by plotting the maximum intensity band at 1286 cm-1 (arising from diazotization of nitrite) versus the concentration of standard solutions. This correlation was found to be linear within the concentration range of 0.25-10 mg L-1, and the limit of detection of the method was 0.39 mg L-1 and 0.61 mg L-1 for RDX and HMX, respectively. Both sensitivity and linearity were better than in similar SERS assays. The proposed SERS method was validated against UV-vis colorimetric method, and the effectiveness of the method to quantify HMX and RDX in real soil samples was investigated. This is the first study on the simultaneous quantification of HMX and RDX in synthetic solutions and real samples by SERS. It may also serve to quantify HMX, emerging as a major impurity in commercial grade RDX samples. © 2017 The Royal Society of Chemistry.","2-s2.0-85026759577"
"10.1016/j.cplett.2016.11.022","https://www.scopus.com/inward/record.uri?eid=2-s2.0-85027943731&doi=10.1016%2fj.cplett.2016.11.022&partnerID=40&md5=d8579ff1e0d069e21adcff12a3dd01cc","In this work, we demonstrated facile and low-cost fabrication of highly sensitive SERS substrates via replacement reaction by immersing Cu foils into a AgNO3solution. Different morphologies of Ag nanostructures were observed on the substrate surface by controlling the reaction time. The growth mechanism of Ag nanostructures on the Cu substrates was also analyzed based on the nanostructure evolution. The Ag-Cu substrates showed optimum SERS enhancement at certain reaction time, and the minimum detected concentration of Rhodamine 6G is as low as 10−13 M. The easy and low-cost fabrication makes the Ag-Cu SERS substrates promising for rapid, sensitive detection of targeted analytes, such as biomolecules, pollutants, and explosives in the environment. © 2016 Elsevier B.V.","2-s2.0-85027943731"
"10.1016/j.snb.2017.02.026","https://www.scopus.com/inward/record.uri?eid=2-s2.0-85012066494&doi=10.1016%2fj.snb.2017.02.026&partnerID=40&md5=ce48e4019181c6dafab344d955b809ad","Nitrogen doped graphene quantum dots (N-GQDs) have been fabricated using lemon juice by a simple and cost effective thermal pyrolysis technique, without the consumption of any harmful chemicals or solvents. N-GQDs displayed excellent water solubility, good stability and excitation dependent down conversion fluorescence (FL). The obtained N-GQDs displayed a strong FL emission at wavelength around 440 nm at optimum excitation wavelength of 340 nm. FL spectrum of N-GQDs showed highly selective and sensitive quenching with the addition of 2,4,6-trinitrophenol (TNP). The calibration curve from Stern − Volmer equation showed a linear range from 0 − 4 μM with obtained detection limit of 420 nM. This work demonstrated simple, green and facile synthesis of N-GQDs and the obtained N-GQDs were successfully applied for the detection of mutagenic water pollutant, TNP. © 2017 Elsevier B.V.","2-s2.0-85012066494"
"10.1016/j.snb.2017.03.137","https://www.scopus.com/inward/record.uri?eid=2-s2.0-85017606203&doi=10.1016%2fj.snb.2017.03.137&partnerID=40&md5=ca37ea1c311bf3af0086cd55f09a8eb7","The literature reports several attempts to predict the responses of gas sensors using as only input the molecular structures of the analyte and sensing material. However, these are restricted to relatively simple and homogeneous materials. The present paper reports for the first time the semiquantitative estimation of the sensing responses of quartz crystal microbalance sensors based on a complex material, taking relative humidity into account. The sensing material is methylated mesoporous silica, and the analytes are vapors of the nitroaromatic compounds 2,4-dinitrotoluene (2,4-DNT) and trinitrotoluene (TNT). Our approach is based on molecular dynamics simulations. The amount of vapor (water, 2,4-DNT or TNT) adsorbed on the sensing surfaces is obtained as a function of their partial pressure by simulating adsorption isotherms at high temperature and extrapolating the results to ambient conditions. Furthermore, a correction factor is introduced to account for the role of residual water within the mesoporous silica. The order of magnitude of the simulated sensing responses to 2,4-DNT and TNT is found to be consistent with experimental data. © 2017 Elsevier B.V.","2-s2.0-85017606203"
"10.1117/12.2265522","https://www.scopus.com/inward/record.uri?eid=2-s2.0-85026519465&doi=10.1117%2f12.2265522&partnerID=40&md5=c57efc7454fe56db0bd1fff037b8c8d5","In this work, we report on fluorescent sensor arrays fabricated by aerosol jet printing on glass substrates to detect explosives-related nitroaromatic species. The printed sensor arrays consist of six different fluorescent polymers responding to nitroaromatic vapors through a photo-induced electron transfer. This results in a quenched fluorescence proportional to the vapor concentration. Distinct fluorescence quenching patterns are detected for nitroaromatic species including nitrobenzene, 1,3-dinitrobenzene and 2,4-dinitrotoluene. The detected fingerprints are evaluated at low concentrations of only 1, 3 and 10 parts-per-billion in air. Linear discriminant analysis is used to train each sensor array enabling the discrimination of the target analyte vapors. To investigate the reproducibility of multiple sensor arrays on a single substrate, the measured fluorescence quenching patterns are used to benchmark the linear discriminant models. For this purpose, the target analytes and vapor concentrations are predicted for each sensor array. On average, we report low and reproducible misclassification rates of about 4 % indicating excellent discriminatory abilities at low concentrations close to the detection limits. We conclude that digital printing of fluorescent polymers offers the potential to realize low-cost sensor arrays for a reliable detection of trace explosives. © 2017 SPIE.","2-s2.0-85026519465"
"10.1016/j.dyepig.2016.10.039","https://www.scopus.com/inward/record.uri?eid=2-s2.0-85000995992&doi=10.1016%2fj.dyepig.2016.10.039&partnerID=40&md5=e6f42f6eb1cac54f86deb0ef1a00edcc","A series of D–π–A–π–D type dyes based on pyrimidines, bearing thiophene linkers, have been studied as sensing fluorophores. Fluorescence studies have demonstrated that the emission of all derivatives is sensitive to the presence of 2,4,6-trinitrotoluene (TNT) and other nitroaromatic compounds (NACs), in their acetonitrile solutions. The detection limits of fluorophores to NACs proved to be in the range from 10−4 to 10−6 mol/L. The time-resolved fluorescence measurements and theoretical investigation into the quenching mechanism in the presence of fluorophore has been performed. The two types of sensor prototypes for handheld sniffer «Nitroscan» (Plant «Promautomatika», Ekaterinburg, Russia) on the basis of non-woven dry wipe and spunlace non-woven fabric with various quantities of the most sensitive fluorophore have been fabricated. The reusable, reversible and sensitive response of the designed prototypes to NACs enables one to qualify these compounds as promising fluorescent sensory materials for detection of NACs. © 2016 Elsevier Ltd","2-s2.0-85000995992"
"10.1038/srep34870","https://www.scopus.com/inward/record.uri?eid=2-s2.0-84993949905&doi=10.1038%2fsrep34870&partnerID=40&md5=0ca8ef9f9227e29a0edbecc1b6476ce4","A self-catenated Zn(II)-organic framework formulated as [Zn 2 (3,3′-bpeab)(oba) 2 ]·DMF (1) exhibiting a six-connected 4 4 ·6 10 ·8 topology has been successfully synthesized through the mixed-ligand of kinked 3,3′-bis[2-(4-pyridyl)ethenyl]azobenzene (3,3′-bpeab) and 4,4′-oxybis-benzoic acid (H 2 oba) under solvothermal condition. UV light triggers isomerization of complex 1 in a single-crystal-to-single-crystal (SCSC) manner, giving rise to a conformational supramolecular isomer 1-UV through the pedal motion of photoresponsive double bonds. Dynamic photo-switching in the obtained light-responsive supramolecular isomers leads to instantly reversible CO 2 uptake. Furthermore, the ligand originated fluorescence emission of water-resistant complex 1 is selectively sensitive to 4-nitrotoluene (4-NT) owing to a higher quenching efficiency of the perilous explosive over other structurally similar nitroaromatics, prefiguring the potentials of 1 as a fluorescence sensor towards 4-NT in aquatic media. © 2016 The Authors.","2-s2.0-84993949905"
"10.1016/j.nima.2016.07.042","https://www.scopus.com/inward/record.uri?eid=2-s2.0-84980319586&doi=10.1016%2fj.nima.2016.07.042&partnerID=40&md5=14c298f999cc0eb40436563226b2fad4","In this work we report on SWAN, the experimental, portable device for explosives detection. The device was created as part of the EU Structural Funds Project “Accelerators & Detectors” (POIG.01.01.02-14-012/08-00), with the goal to increase beneficiary's expertise and competencies in the field of neutron activation analysis. Previous experiences and budged limitations lead toward a less advanced design based on fast neutron interactions and unsophisticated data analysis with the emphasis on the latest gamma detection and spectrometry solutions. The final device has been designed as a portable, fast neutron activation analyzer, with the software optimized for detection of carbon, nitrogen and oxygen. SWAN's performance in the role of explosives detector is elaborated in this paper. We demonstrate that the unique features offered by neutron activation analysis might not be impressive enough when confronted with practical demands and expectations of a generic homeland security customer. © 2016 Elsevier B.V.","2-s2.0-84980319586"
"10.1007/s11468-016-0212-7","https://www.scopus.com/inward/record.uri?eid=2-s2.0-84962822273&doi=10.1007%2fs11468-016-0212-7&partnerID=40&md5=fa1b80a9c67fc234eb1b1f1c4ef9c1d6","We report a simple, facile, selective, and highly sensitive colorimetric sensor for nitroguanidine explosive. The colorimetric sensor utilizes the aggregation of creatinine-modified gold nanoparticles (AuNPs), which was caused by nitroguanidine via hydrogen bond interaction between nitroguanidine and creatinine, leading to a color change from red to blue to colorless dependent on the concentration of nitroguanidine. Under optimum sensing concentrations, the absorbance changes of AuNPs at 519 nm were linear with the concentration of nitroguanidine in the range of 15–55 μM with a correlation coefficient of 0.997. The limit of detection of the colorimetric sensor was 1 μM based on the signal-to-noise of three, which has improved by as much as five orders of magnitude as compared with the traditional volumetric method and up to three orders of magnitude as compared with fluorescence approach as well. Moreover, as low as 15 μM of nitroguanidine can be visually detected by the naked eye without instrumentation. The colorimetric sensor also displayed remarkable selectivity to nitroguanidine against other explosives and common inorganic salts. It was robust and can be employed for reliable sensing of spiked nitroguanidine in real water samples with good recovery and accuracy. © 2016, Springer Science+Business Media New York.","2-s2.0-84962822273"
"10.3390/s16081281","https://www.scopus.com/inward/record.uri?eid=2-s2.0-85012034031&doi=10.3390%2fs16081281&partnerID=40&md5=e442e098d9e589145e8e2a86efa2bfe3","Using square wave voltammetry, we show an increase in the electrochemical detection of trinitrotoluene (TNT) with a working electrode constructed from plasma modified graphene on a SiC surface vs. unmodified graphene. The graphene surface was chemically modified using electron beam generated plasmas produced in oxygen or nitrogen containing backgrounds to introduce oxygen or nitrogen moieties. The use of this chemical modification route enabled enhancement of the electrochemical signal for TNT, with the oxygen treatment showing a more pronounced detection than the nitrogen treatment. For graphene modified with oxygen, the electrochemical response to TNT can be fit to a two-site Langmuir isotherm suggesting different sites on the graphene surface with different affinities for TNT. We estimate a limit of detection for TNT equal to 20 ppb based on the analytical standard S/N ratio of 3. In addition, this approach to sensor fabrication is inherently a high-throughput, high-volume process amenable to industrial applications. High quality epitaxial graphene is easily grown over large area SiC substrates, while plasma processing is a rapid approach to large area substrate processing. This combination facilitates low cost, mass production of sensors. © 2016 by the authors; licensee MDPI, Basel, Switzerland.","2-s2.0-85012034031"
"10.1039/c6py01358a","https://www.scopus.com/inward/record.uri?eid=2-s2.0-84992168512&doi=10.1039%2fc6py01358a&partnerID=40&md5=fa528a85a196722d06c91d5612d62a4c","Two unique aggregation-induced emission (AIE) active polymers poly(triphenyl ethene) (PTriPE) and poly(tetraphenyl ethene) (PTPE), comprising sole repeating units, triphenyl and tetraphenyl, respectively, were synthesized through the Suzuki coupling of (2,2-dibromoethene-1,1-diyl)dibenzene and related di-boronic acid or ester compounds. The polymers PTriPE and PTPE had number-molecular weights (10100-17400) with polydispersity indices of 1.5-1.7, and they were soluble in common organic solvents. The polymers in THF/H2O mixtures were able to form remarkably stable nanoparticles and no agglomeration was observed even when stored at 4 °C for several months. The polymer PTriPE and PTPE exhibited much more significant AIE activities when compared to their corresponding small AIE molecule 1,1,2,2-tetraphenylethene (TPE) and 4,4′-(2,2-diphenylethene-1,1-diyl)dibiphenyl (DPDB) in THF-H2O mixtures. The fluorescence of polymer nanoparticles in THF/H2O mixture could be quenched by various nitro-compounds, and PTriPE nanoparticles demonstrated a better fluorescence quenching response than PTPE. The film formed by PTriPE nanoparticles showed a reasonable fluorescence quenching response to nitro-compounds, for example, ∼5 ppb in the case of 2,4,6-trinitrotoluene vapor, despite its thickness approaching the micrometer level. Furthermore, PTriPE-based paper sensors were fabricated from its polymer nanoparticles' solution, and is still effective with a polymer surface concentration as low as 1.0 μg cm-2 in detecting various nitro-compounds at a scale less than 1 ng, making it a useful tool for a quick, inexpensive and most importantly, highly sensitive detection of nitro-compounds based explosives. © The Royal Society of Chemistry 2016.","2-s2.0-84992168512"
"10.1016/j.snb.2017.06.059","https://www.scopus.com/inward/record.uri?eid=2-s2.0-85020939131&doi=10.1016%2fj.snb.2017.06.059&partnerID=40&md5=c8a08ce6daf359665fc8231f4d487ac3","A series of poly(arylene-ethynylene)s (PAEs) containing pentiptycene and tbutylpyrene or pyrene in the main chain were synthesized. Introduction of pyrene moiety in the pentiptycene polymeric backbone made the polymers extremely sensitive and selective towards TNT in aqueous solution as well as vapour phase as compared to the other interfering nitroaromatic compounds (NACs) like DNT and PA. In solid state, one of the polymer P2 showed superior sensitivity towards TNT vapours with 60.4% and 90% fluorescence loss within respective 10 s and 30 s of exposure to TNT vapours, which is much higher than most of the reported NACs sensors. Even towards aqueous NACs, the performance of P2 is the best, with 69.8% fluorescence of P2 film getting quenched within 60 s of immersion in aqueous solution of TNT (50 μM). Fluorescence regain study showed that 94% fluorescence is re-gained after dipping the fluorescence-quenched polymer film in methanol for 20 s. The polymers were found to possess high thermal stability (282–585 °C) and appreciably high fluorescence quantum yield (0.39–0.65). We also report the sub-nanoscopic free volume and its distribution in the polymers, as quantified by positron annihilation life time spectroscopy (PALS). © 2017 Elsevier B.V.","2-s2.0-85020939131"
"10.1016/j.electacta.2016.08.123","https://www.scopus.com/inward/record.uri?eid=2-s2.0-84984656527&doi=10.1016%2fj.electacta.2016.08.123&partnerID=40&md5=7e760e3d0f92bc94a9e21a2f42cb4555","A perovskite (SrTiO3) and reduced graphene oxide (rGO) based nanocomposite (rGO/SrTiO3) material has been synthesized in-situ. The rGO/SrTiO3 nanocomposite was characterized by PXRD, SEM, EDX mapping, TEM and SAED pattern to confirm its purity and morphology. The surface of the glassy carbon electrode (GCE) was modified by coating rGO/SrTiO3 nanocomposite without any binder. This modified electrode GCE-rGO/SrTiO3 (MGCE) was employed for electrochemical detection of nitro-substituted aromatics such as p-nitrophenol (p-NP), 2,4-dinitrophenol (2,4-DNP), 2,4-dinitrotoluene (2,4-DNT) and 2,4,6-trinitrophenol (TNP) which shows a rapid electronic communications. The MGCE exhibited the limit of detection (LOD) of 110 nM, 134 nM, 128 nM, 146 nM, high sensitivity of 193.43 μA μM−1 cm−2, 25.34 μA μM−1 cm−2, 71.66 μA μM−1 cm−2, 13.16 μA μM−1 cm−2 and a linear range between 0.3–0.8, 0.4–0.7, 0.5–0.8, 0.5–0.7 μM for p-NP, 2,4-DNP, 2,4-DNT and TNP, respectively. The developed MGCE sensor thus implemented is also advantageous for its low cost, stability, reliability and rendering applications for real system analysis. © 2016","2-s2.0-84984656527"
"10.1016/j.snb.2017.03.170","https://www.scopus.com/inward/record.uri?eid=2-s2.0-85017619118&doi=10.1016%2fj.snb.2017.03.170&partnerID=40&md5=fac144609eb853fe9fb9d6cb520f0739","Three new pyrene-substituted benzimidazole-isoquinolinones (2–4) which are different in the positions and numbers of the pyrene groups are designed and synthesized via imidation-condensation reaction and Suzuki coupling. The structural elucidations are performed using standard spectroscopic techniques and computational calculations. These compounds exhibit interesting aggregation-induced emission enhancement (AIEE) in highly aqueous THF media and selective fluorescent quenching toward trinitrotoluene (TNT). The compound with two pyrene units (4) has the best selectivity toward TNT and has a quenching efficiencies (Ksv) of 6.0 × 104 M−1, which leads to the estimation of the detection limit of 0.25 ppm TNT. The paper-based sensors prepared from 4 can readily detect TNT in aqueous media by naked-eye observation at the concentration as low as 50 μM. It can also detect TNT vapor in closed chamber within 5 min of exposure at room temperature. © 2017 Elsevier B.V.","2-s2.0-85017619118"
