"DOI","Link","Abstract","EID"
"10.1364/OE.26.008069","https://www.scopus.com/inward/record.uri?eid=2-s2.0-85044764407&doi=10.1364%2fOE.26.008069&partnerID=40&md5=13d31e77c8966e1eec82acf07fedf5c6","We report the standoff (up to ∼2 m) and remote (∼8.5 m) detection of novel high energy materials/explosive molecules (Nitroimidazoles and Nitropyrazoles) using the technique of femtosecond laser induced breakdown spectroscopy (LIBS). We utilized two different collection systems (a) ME-OCT-0007 (commercially available) and (b) Schmidt-Cassegrain telescope for these experiments. In conjunction with LIBS data, principal component analysis was employed to discriminate/classify the explosives and the obtained results in both configurations are compared. Different aspects influencing the LIBS signal strength at far distances such as fluence at target, efficiency of collection system etc. are discussed. © 2018 Optical Society of America under the terms of the OSA Open Access Publishing Agreement.","2-s2.0-85044764407"
"10.1007/s11141-018-9843-1","https://www.scopus.com/inward/record.uri?eid=2-s2.0-85046152365&doi=10.1007%2fs11141-018-9843-1&partnerID=40&md5=af209ac1e63f14642c31950f0fb9480b","We show prospects for using the method of high-resolution terahertz spectroscopy for a continuous analysis of the decomposition products of energy substances in the gas phase (including short-lived ones) in a wide temperature range. The experimental setup, which includes a terahertz spectrometer for studying the thermal decomposition reactions, is described. The results of analysis of the gaseous decomposition products of energy substances by the example of ammonium nitrate heated from room temperature to 167°C are presented. © 2018, Springer Science+Business Media, LLC, part of Springer Nature.","2-s2.0-85046152365"
"10.1039/c7py01700f","https://www.scopus.com/inward/record.uri?eid=2-s2.0-85041292819&doi=10.1039%2fc7py01700f&partnerID=40&md5=2075f6ddde1e1d4cb2ac05b07e40d323","Through-bond conjugated polymers have been widely studied and shown great potential in various applications due to their conductive or luminescence properties, while through-space conjugated polymers are less explored. In this work, a unique through-space conjugated monomer derived from folded tetraphenylethene (TPE) is utilized to build a series of new polymers by Pd-catalyzed Suzuki or Stille coupling reactions. The new polymers are well characterized, and their optical and thermal properties and potential application in explosive detection are investigated. All the polymers show good thermal stability with high decomposition temperatures (340-436 °C). They exhibit higher fluorescence quantum yields in aggregates and films than in solutions, namely they show aggregation-enhanced emission (AEE) properties. They perform well in explosive detection in aqueous media using picric acid as a model. The nanoaggregates of the polymers show high quenching constants of up to 552000 M-1, which is much higher than those in THF solution (78200 M-1), demonstrating the superamplification effect of the polymer nanoaggregates in aqueous media. These new through-space conjugated polymers could be new kinds of fluorescent materials and worth further exploration. © This journal is The Royal Society of Chemistry.","2-s2.0-85041292819"
"10.1021/acsomega.8b01318","https://www.scopus.com/inward/record.uri?eid=2-s2.0-85050998908&doi=10.1021%2facsomega.8b01318&partnerID=40&md5=b45b8235ee0f57636d1997d1b57ff747","We present a systematic study on the fabrication, characterization of versatile, and low-cost filter paper-based surface-enhanced Raman spectroscopy (SERS) substrates loaded with salt-induced aggregated Ag/Au nanoparticles (NPs). These were demonstrated as efficient SERS substrates for the detection of multiple explosive molecules such as picric acid (5 μM), 2,4-dinitrotoluene (1 μM), and 3-nitro-1,2,4-triazol-5-one (10 μM) along with a common dye molecule (methylene blue, 5 nM). The concentrations of the dye and explosive molecules in terms of mass represent 31.98 pg, 11.45 ng, 1.82 ng, and 13.06 ng, respectively. Silver (Ag) and gold (Au) colloidal NPs were prepared by femtosecond laser (∼50 fs, 800 nm, 1 kHz) ablation of Ag/Au-target immersed in distilled water. Subsequently, the aggregated nanoparticles were achieved by mixing the pure Ag and Au NPs with different concentrations of NaCl. These aggregated NPs were characterized by UV-visible absorption and high-resolution transmission electron microscopy techniques. The SERS substrates were prepared by soaking the filter paper in aggregated NPs. The morphologies of the paper substrates were investigated using field-emission scanning electron microscopy technique. We have achieved superior enhancements with high reproducibility and sensitivity for filter paper substrates loaded with Ag/Au NPs mixed for an optimum concentration of 50 mM NaCl. © 2018 American Chemical Society.","2-s2.0-85050998908"
"10.1016/j.forc.2018.03.008","https://www.scopus.com/inward/record.uri?eid=2-s2.0-85046496008&doi=10.1016%2fj.forc.2018.03.008&partnerID=40&md5=eaed87227c5c72f3634c37543c07b189","A microfluidic paper-based analytical device (µPAD) has been developed for the onsite determination of low explosives residues. The device is capable of simultaneous detection of a variety of metallic salts using colorimetric detection. The µPAD was printed on chromatography paper with wax ink, allowing for the creation of a set of hydrophobic channels. Each channel contains a specific set of reagents that yields a color change upon interaction with a specific metal salt. The device is capable of performing six simultaneous tests, including the detection of metallic salts present in primer residues and pyrotechnic low explosive devices. Metals detected include lead, barium, antimony, iron, aluminum, zinc, and magnesium. Detection times were found to be less than 10 min and visual limits of detection ranged from 0.025 to 0.4 µg of these metallic compounds. The resultant paper chip was then tested against various interferences and used to examine a number of different pyrotechnic compositions. This new device should prove useful in onsite detection of post-blast residues of pyrotechnics in the field due its portability and ease of use. © 2018","2-s2.0-85046496008"
"10.1002/chem.201705782","https://www.scopus.com/inward/record.uri?eid=2-s2.0-85043354969&doi=10.1002%2fchem.201705782&partnerID=40&md5=549e2b925ee91323a47512f1bf10f638","Detection of nitroaromatics at ultralow concentration is a major security concern in defense, forensics, and environmental science. To this end, a new triarylamine-cored dendritic gelator (OGR) was synthesized, which produced thermoreversible, thixotropic, and fluorescent gels in n-octanol. On gelation, both π–π* transitions and the emission peak of the gelator show redshifts with a 4.5-fold increase of fluorescence intensity in the gel state indicating J-aggregation. The nitrogen lone-pair electrons of OGR make it a donor, and electron transfer occurs to acceptor nitroaromatics causing fluorescence quenching, which is further promoted due to its acidity. The Stern–Volmer rate constants measured for different nitroaromatics showed that it senses picric acid (PA) best. The contact-mode technique with OGR-treated paper strips can allow naked-eye detection of PA under UV light down to 10−11 m concentration within 30 s. Reusability of the gel is achieved by treating OGR@PAx with NaOH solution. Impedance spectroscopic results indicated a decrease of both charge-transport resistance and Warburg impedance on successive addition of PA. The limits of detection of PA determined from fluorescence and impedance measurements match well. Thus, the OGR gel is a reusable, low-cost, specific sensor for PA by naked-eye colorimetric, fluorescence, and impedance techniques. © 2018 Wiley-VCH Verlag GmbH & Co. KGaA, Weinheim","2-s2.0-85043354969"
"10.1021/acsomega.8b01180","https://www.scopus.com/inward/record.uri?eid=2-s2.0-85051705955&doi=10.1021%2facsomega.8b01180&partnerID=40&md5=d15cd498e489f6015e0c6c9c374ee258","Herein, we report the preparation of graphene oxide dots (GO dots) by fine-tuning the carbonization degree of citric acid. The structure of GO dots was characterized by absorption spectroscopy, Fourier transform infrared spectroscopy, Raman spectroscopy, as well as high-resolution scanning electron microscopy and transmission electron microscopy analyses. The typical particle size of the GO dots was 42 nm. The fluorescent characteristics of the GO dots were analyzed by fluorescence spectroscopy. Once excited at 360 nm, the GO dots were fluorescent in the range of 450-550 nm, which was dependent on the excitation wavelength. Further, GO dots were effectively utilized for multifarious applications such as photoinduced electron transfer and detection of explosives and biomolecules. The emission property of GO dots was competently quenched by viologens, picric acid (PA), and bilirubin (BR). The mechanism of quenching by viologens and explosives/biomolecules was found to be due to photoinduced electron transfer and the internal filter effect, respectively. Intriguingly, the detection minimum of PA is in the nanomolar level. Toward commercialization, the economic test strips have also been introduced for the identification of PA. Furthermore, the GO dots have been applied as an efficient luminescent bioprobe for a selective and perceptive finding of BR. © 2018 American Chemical Society.","2-s2.0-85051705955"
"10.1016/j.jaap.2018.06.008","https://www.scopus.com/inward/record.uri?eid=2-s2.0-85048858977&doi=10.1016%2fj.jaap.2018.06.008&partnerID=40&md5=d1a6e9b58d463dd9020022e89cab3d06","In order to analyze the inhibition effect of the additive on the thermal decomposition characteristics of ammonium nitrate (AN), thermal stability and thermal decomposition behavior of AN and its mixtures with various concentrations of ammonium dihydrogen phosphate (ADP) are systematically investigated by DSC-TG, DSC-TG-QMS and TG-FTIR. Breaking point value of the samples is obtained as an evaluation parameter for thermal safety. Experimental results show that the AN-ADP mixtures show higher onset decomposition temperatures, narrower reaction temperature region and lower enthalpy values than those of pure AN. The main evolved decomposition gases of AN are NH3, H2O, NO, N2O, NO2 and HNO3, while the major gaseous products of the AN mixture with ADP are NH3, H2O, NO, N2O and NO2. Furthermore, the generation of NO and NO2 is obviously postponed in the AN mixture. In addition, the breaking point value of AN is markedly improved by ADP. The decomposition mechanism of AN-ADP mixture is concluded and the inhibition mechanism of ADP is proposed. It is concluded that ADP is an effective inhibitor for AN and its thermal stability is effectively enhanced. © 2018 Elsevier B.V.","2-s2.0-85048858977"
"10.1016/j.jphotochem.2017.07.044","https://www.scopus.com/inward/record.uri?eid=2-s2.0-85028363572&doi=10.1016%2fj.jphotochem.2017.07.044&partnerID=40&md5=0dc1053f04d1cd57668b133b7faf6945","A bright blue emitting excited-state intramolecular proton transfer (ESIPT) molecule, 2-(4,5-bis(4-chlorophenyl)-1H-imidazol-2-yl)-4-chlorolphenol (HPICl) has been designed and synthesized, whose solvent-dependent PLQY is up to 0.53 in EtOH, and 0.46 as solid state. Fluorescence quenching experiments manifest the selective detection of picric acid (PA) and p-nitrophenol (p-NP) over other nitroaromatic explosive compounds, which is closely related with the presence of –OH groups on these two molecules that affect the ESIPT-based luminescence character of HPICl. © 2017 Elsevier B.V.","2-s2.0-85028363572"
"10.1007/s10973-017-6706-5","https://www.scopus.com/inward/record.uri?eid=2-s2.0-85029578319&doi=10.1007%2fs10973-017-6706-5&partnerID=40&md5=55a3fd80513d261c66c17b3dd083d04e","In this paper, the thermal stability and decomposition kinetics of 10 nitric esters including nitroglycerine (NG), pentaerythritol tetranitrate (PETN), trimethylolethane trinitrate (TMETN), dipentaerythritol hexanitrate (DiPEHN), trimethylolpropane trinitrate (TMPTN), xylitol pentanitrate (XPN), sorbitol hexanitrate (SHN), erythritol tetranitrate (ENT), mannitol hexanitrate (MHN) and nitroisobutylglycerol trinitrate (NiBGT) are investigated by non-isothermal TG and DSC. It has been shown that the mass loss processes of NG, TMETN and TMPTN are more dependent on the heating rate, and the simultaneous evaporation makes the initial temperatures for their mass loss lower than those of the other nitric esters. Based on the correlations among their thermal stability, activation energy, detonation velocity and heat of combustion, one could conclude that the oxygen coefficient (α) plays a positive role on the decomposition heat release efficiency (ηd) when it is less than one, whereas when the α is greater than or equals to one, the fuel elements such as C and H contents would play a decisive role on ηd. It has been further proved that the order of contribution rate of function groups on the tertiary carbon to the detonation velocity could be –CH3 < –NO2 < –C2H5 < –ONO2. In addition, the introduction of function groups to the tertiary carbon is in favor of increasing the thermal stability of nitric esters due to increase in symmetry and rigidity of their molecules. The proportion numbers (Cs) of methylene group (–CH2–) to tertiary carbon or quaternary carbon will, to some extent, determine the thermal stability of the nitric esters. © 2017, Akadémiai Kiadó, Budapest, Hungary.","2-s2.0-85029578319"
"10.1371/journal.pone.0201297","https://www.scopus.com/inward/record.uri?eid=2-s2.0-85052333923&doi=10.1371%2fjournal.pone.0201297&partnerID=40&md5=12027f26a737a356b4f9a0ce6eae8985","We discuss an effective time-dependent THz spectroscopy method for the detection and identification of a substance with an inhomogeneous surface using a broadband THz signal reflected from the substance. We show that a successful and reliable identification can be made using the single long-duration THz signal, which contains not only the main reflected pulse, but also several sub-pulses. The method does not use averaging of the measured THz signals over the viewing angles and scanning over the surface area, which significantly increases the signal processing speed. The identification is based on the method of spectral dynamics analysis together with the integral correlation criteria (ICC). We compare the absorption spectral dynamics of a substance under analysis with the corresponding dynamics for a standard substance from database. For reliable and effective substance detection, we propose to use several ICC simultaneously in different time intervals, which contain not only the main pulse of the reflected THz signal, but also the sub-pulses. This way, one can detect and identify the substance in the sample with high probability. As examples of identification, we used the THz signals reflected from the plastic explosive PWM C4 with both rough and concave surface. We show that the main pulse, reflected from the inhomogeneous surface of the sample, contains information about its absorption frequencies. © 2018 Trofimov, Varentsova. This is an open access article distributed under the terms of the Creative Commons Attribution License, which permits unrestricted use, distribution, and reproduction in any medium, provided the original author and source are credited.","2-s2.0-85052333923"
"10.4018/978-1-5225-3862-2.ch004","https://www.scopus.com/inward/record.uri?eid=2-s2.0-85050040277&doi=10.4018%2f978-1-5225-3862-2.ch004&partnerID=40&md5=3cf68b2ad55494151366341015bb3f0e","Fluorescence quenching is a promising technique for chemical sensing applications such as the detection of explosive trace vapors. Nitroaromatic explosives are one of the primary targets for this approach enabling ultra-low detection limits down to sub parts-per-billion in air. Many studies, however, focus on enhanced sensor sensitivity, whereas practical applications often require the identification and quantification of detected species. Electronic noses and efficient sensor systems are a promising solution to address this challenge. The authors review recent approaches and trends for explosive trace vapor detection and discuss theoretical concepts for fluorescence quenching as well as target analytes, sensor materials, and fabrication techniques. Statistical learning techniques such as principal component analysis and linear discriminant analysis, sensor systems, and camera-based read-out strategies are in the focus of the chapter. The authors conclude with recommendations and solutions for the elaborated challenges and with visions on future research directions. © 2018, IGI Global.","2-s2.0-85050040277"
"10.1016/j.snb.2017.10.001","https://www.scopus.com/inward/record.uri?eid=2-s2.0-85030854268&doi=10.1016%2fj.snb.2017.10.001&partnerID=40&md5=4faab84872dc910112f8c2af3f8d1e42","Sensitive and selective vapor detection of hydrogen peroxide have been especially demanded in the fields of both the detection of peroxide-based explosives and the analysis of exhaled breath for clinical diagnosis. In this paper, we report hydrogen peroxide vapor sensor transducers operated at room temperature using platinum (Pt) nanoparticles-decorated single-walled carbon nanotube (SWCNT) network films. The SWCNT films are coated on a SiO2/Si substrate using a low-cost, effective, and scalable spray printing process. Then, the Pt nanoparticles are decorated on SWCNT surfaces by an effective photo-reduction process, which is performed by immersing the SWCNT films into the H2PtCl6 solution mixed with methanol and deionized water under UV irradiation with a wavelength of 254 nm. The active organic radicals produced from methanol under UV irradiation rapidly reduce PtCl62− ions to Pt0 on SWCNT surfaces within 5 min. The nanoparticle size is modulated from 2 to 10 nm by controlling the molar concentrations of the H2PtCl6 solutions in a range from 2 to 50 mM. By forming interdigitated electrodes on the Pt nanoparticles-decorated SWCNT films, sensor transducers are fabricated for detection of hydrogen peroxide (H2O2) vapor. The sensors show a linear response to H2O2 vapor in a range from ca. 2 to 60 ppm and weak responses to NH3 and SO2 gases and negligible responses to NO2, CO, and C6H6 gases, which are representative biomarkers of exhaled breath. We expect that in the future, our sensing films will be able to be utilized in highly sensitive, real-time hydrogen peroxide vapor sensors. © 2017 Elsevier B.V.","2-s2.0-85030854268"
"10.1016/j.talanta.2018.05.036","https://www.scopus.com/inward/record.uri?eid=2-s2.0-85047056942&doi=10.1016%2fj.talanta.2018.05.036&partnerID=40&md5=214d492bde674d89e7183faa83c8ef9f","A novel fluorescent conjugated polymer (poly(2-amino-N-(2-((4-ethynylphenyl) ethynyl) phenyl)-5-guanidinopentanamide)-1,4-phenylethynylene-1,4-phenyleneethynylene, PPE-Arg) was synthesized in this paper. We found that PPE-Arg could be quenched by picric acid (PA). Photoinduced electron transfer (PET) mechanism can be used to describe the fluorescence quenching of PPE-Arg. It could be speculated that the photo-induced electrons may be transferred from PPE-Arg to nitroaromatic explosives. In this paper, the experiment conditions and detection performance of PPE-Arg were systematically studied. The experiment results demonstrate PPE-Arg as a sensor for PA has a good linear range from 5 × 10−7 to 6 × 10−5 mol L−1 with the calculated limit of detection (LOD) to be 1.0 × 10−7 mol L−1. Meanwhile, reaction time between PPE-Arg and PA is less than 1 min. This proposed sensor was applied to rapidly detect nitroaromatic explosives in environmental water samples and satisfactory results were obtained. © 2018 Elsevier B.V.","2-s2.0-85047056942"
"10.1007/s13320-018-0497-6","https://www.scopus.com/inward/record.uri?eid=2-s2.0-85049730008&doi=10.1007%2fs13320-018-0497-6&partnerID=40&md5=fc5fb2c62effe23e1f284d0ccca4fcd3","A composite one-dimensional (1D) Ag sinusoidal nanograting aiming at label-free surface enhanced Raman scattering (SERS) detection of TNT with robust and reproducible enhancements is discussed. 1D periodic sinusoidal SiO2 grating followed by Ag evaporation is proposed for the creation of reproducible and effective SERS substrate based on surface plasmon polaritons (SPPs). The optimal structure of 1D sinusoidal nanograting and its long-range SERS effect are analyzed by using the finite difference time domain (FDTD). Simulation SERS enhancement factor (EF) can be 5 orders of magnitude as possible. This SERS substrate is prepared by the interference photolithography technology, its SERS performance is tested by Rh6G detection experiments, and the actual test EF is about 104. The label-free SERS detection capacity of TNT is demonstrated in the experiment. © 2018, The Author(s).","2-s2.0-85049730008"
"10.1016/j.snb.2018.03.072","https://www.scopus.com/inward/record.uri?eid=2-s2.0-85044158979&doi=10.1016%2fj.snb.2018.03.072&partnerID=40&md5=c35983712a9b8e65545804d3843a1e33","Development of rapid, sensitive, and visual detection of nitroaromatic explosives is of great importance for homeland security and human safety. Herein, three novel fluorescent nanoporous polymers (FNPs), HPP-1–HPP-3, were first prepared by Heck reactions of octavinylsilsesquioxane with ethene derivatives containing bis-, tri-, or tetrakis- bromophenyl groups. Based on highly sensitive detection of explosives, including p-nitrotoluene (NT), 2,4-dinitrotoluene (DNT), 2,4,6-trinitrotoluene (TNT), 4-nitrophenol (NP), 2,4-dinitrophenol (DNP) and picric acid (PA), and high selectivity for detecting TNT and PA, by HPP-2 dispersion in ethanol, a fluorescent paper sensor was developed by a new fabrication process, i.e., vacuum filtrating of HPP-2 dispersion in ethanol, followed by washing and natural drying. The resultant paper sensor was found to be sensitive to explosives in the solution, solid and vapor phase with a rapid response time of < 10 s by visually observing the fluorescence quenching phenomenon. Moreover, this paper sensor is recyclable with desirable fluorescence resuming ratio, which is higher than 75% after 10 times recycle detection. This developed paper sensor is promisingly applied for rapid, on-site and visual sensing of explosive residuals. The remarkable fluorescence and reusability of this sensor could be expanded to other fluorescence detection of residuals. © 2018 Elsevier B.V.","2-s2.0-85044158979"
"10.1021/acs.analchem.8b00715","https://www.scopus.com/inward/record.uri?eid=2-s2.0-85047538841&doi=10.1021%2facs.analchem.8b00715&partnerID=40&md5=dbcfd47776d8c2da88ba4ca6e2b5bbe0","Since nitroaromatic- and nitramine-type energetic materials, mostly arising from military activities, are persistent pollutants in soil and groundwater, on-site sensing of these hazardous chemicals has gained importance. A novel electrochemical sensor was designed for detecting nitroaromatic- and nitramine-type energetic materials, relying on gold nanoparticles (Aunano), modified glassy carbon (GC) electrode coated with nitro-energetic memory-poly(carbazole-aniline) copolymer (Cz-co-ANI) film (e.g., TNT memory-GC/P(Cz-co-ANI)-Aunano modified electrode). Current was recorded against concentration to build the calibration curves that were found to be linear within the range of 100-1000 μg L-1 for 2,4,6-trinitrotoluene (TNT) and 2,4-dinitrotoluene (DNT): 50-1000 μg L-1 for 1,3,5-trinitro-1,3,5-triazacyclohexane (RDX) and octahydro-1,3,5,7-tetranitro-1,3,5,7-tetrazocine (HMX). The corresponding limits of detection were 25 μg L-1 for TNT, 30 μg L-1 for DNT, and 10 μg L-1 for both RDX and HMX, using nitro-energetic memory-GC/P(Cz-co-ANI)-Aunano electrodes. These electrodes were used separately, and specific determinations were made in various mixtures of nitro-energetic materials. The developed method could be efficiently used in electroanalyzing nitroaromatics and nitramines in military explosives (i.e., comp B, octol, and comp A5). The sensor electrodes were specific for the tested nitro-energetic compounds and did not respond to paracetamol-caffeine-based analgesic drug, acetylsalicylic acid (aspirin), sweetener, and sugar that can be used as camouflage materials in passenger belongings. The developed method was statistically validated against the standard LC-MS reference method in contaminated clay soil samples containing TNT and RDX explosives. © 2018 American Chemical Society.","2-s2.0-85047538841"
"10.1016/j.chemphys.2018.01.010","https://www.scopus.com/inward/record.uri?eid=2-s2.0-85041403028&doi=10.1016%2fj.chemphys.2018.01.010&partnerID=40&md5=c9296ca082cd560eeaf6e7073dc6769e","Two sample detectors used to analyze the emission from Gas Chromatography (GC) columns are the Flame Ionization Detector (FID) and the Electron Capture Detector (ECD). Both of these detectors involve ionization of the sample molecules and then measuring electric current in the gas using a Faraday cup. In this paper a newly discovered method of ion counting, Nanotechnology Molecular Tagging (NMT) is tested as a replacement to the Faraday cup in GCs. In this method the effective physical volume of individual molecules is enlarged up to 1 billion times enabling them to be detected by an optical particle counter. It was found that the sensitivity of NMT was considerably greater than the Faraday cup. The background in the NMT was circa 200 ions per cm3, corresponding to an extremely low electric current ∼10−17 A. © 2018 Elsevier B.V.","2-s2.0-85041403028"
