"DOI","Link","Abstract","EID"
"10.1016/j.saa.2012.04.041","https://www.scopus.com/inward/record.uri?eid=2-s2.0-84865305453&doi=10.1016%2fj.saa.2012.04.041&partnerID=40&md5=a90ad6268e696705fa0ea9d84a781bab","The detection of nitroaromatics in aqueous solutions by a novel pyrene-functionalized film has been investigated in the present study. The pyrene moieties were attached on the glass surface via a long flexible spacer based on self-assembled monolayer technique. Steady-state fluorescence measurements revealed that these surface-attached pyrene moieties exhibited both monomer and excimer emission. Nitroaromatics such as 2,4,6-trinitrotoluene, 2,4-dinitrotoluene, and 2,4,6-trinitrophenol (picric acid) were found to efficiently quench the fluorescence emission of this film. The quenching results demonstrated that the excimer emission of these surface-confined pyrene moieties is more sensitive to the presence of nitroaromatics than the monomer emission. The quenching mechanism was examined through fluorescence lifetime measurement and it revealed that the quenching is static in nature and may be caused by electron transfer from the polycyclic aromatics to the nitroaromatics. Furthermore, the response of the film to nitroaromatics is fast and reversible, and the obtained film shows promising potentials in detecting explosives in aqueous environment. © 2012 Elsevier B.V. All rights reserved.","2-s2.0-84865305453"
"10.1016/j.tetlet.2012.08.134","https://www.scopus.com/inward/record.uri?eid=2-s2.0-84867241616&doi=10.1016%2fj.tetlet.2012.08.134&partnerID=40&md5=88d0cea6296ef3a61c9ebf48b38be11f","Tricyclohexane triperoxide (TCTP) was synthesized as a main by-product of tetraoxane synthesis and was characterized by spectroscopic techniques viz. 1H NMR, 13C NMR, FT-IR and Raman. The single crystal X-ray structure revealed the inclusion of solvent in 1:1 stoichiometric ratio involving a unique trifurcated C(sp 3)-H⋯O hydrogen bonding imparting remarkable symmetry to the molecule. The thermal stability of single crystal was determined by TG-DTA and DSC. © 2012 Elsevier Ltd. All rights reserved.","2-s2.0-84867241616"
"10.1088/0965-0393/20/6/065010","https://www.scopus.com/inward/record.uri?eid=2-s2.0-84865437334&doi=10.1088%2f0965-0393%2f20%2f6%2f065010&partnerID=40&md5=cac4ec411781342062b3ddd9b3eb3ab2","We have studied the interfaces between octahydro-1,3,5,7-tetranitro-1,3,5, 7-tetrazocine (HMX), 1,3,5-triamino-2,4,6-trinitrobenzene (TATB) and graphite, where the former is a sensitive explosive, the middle one is an insensitive explosive and the latter is a desensitizer. The force-field across the interfaces is obtained by ab initio calculation and least-squares optimization. We use this force-field to simulate the breaking and deformation processes of the HMX-TATB-graphite interface and polycrystal systems. The breaking, coating and plasticizing properties are discussed. A set of mechanical parameters for the mixture explosives is obtained. © 2012 IOP Publishing Ltd.","2-s2.0-84865437334"
"10.1016/j.comptc.2012.05.013","https://www.scopus.com/inward/record.uri?eid=2-s2.0-84863083812&doi=10.1016%2fj.comptc.2012.05.013&partnerID=40&md5=c42316ee53530fe9d5ed7e481ec9e923","The heats of formation (HOF), energetic properties, and thermal stability for a series of furazano[3,4-b]pyrazine derivatives with different substituents or nitrogen-containing heterocycles were studied by using density functional theory. It is found that -N 3 or nitrogen-containing heterocycle is an effective structural unit for improving the HOF values of the derivatives. The calculated detonation velocities and detonation pressures indicate that the substitution of -NO 2, -NF 2, or NO 2-substituted heterocycle is very useful for enhancing their detonation performance. An analysis of the bond dissociation energies for several relatively weak bonds suggests that most of the derivatives have good thermal stability. By and large, the N-O bond in the furazano[3,4-b]pyrazine ring is the weakest one and the ring cleavage may happen in thermal decomposition. Considered the detonation performance and thermal stability, three compounds may be considered as the potential candidates of high energy density materials. © 2012 Elsevier B.V..","2-s2.0-84863083812"
"10.1002/rcm.6213","https://www.scopus.com/inward/record.uri?eid=2-s2.0-84859869182&doi=10.1002%2frcm.6213&partnerID=40&md5=64bc67d911fd5cab991e7e0fe6637254","RATIONALE Residual quantities of explosives deposited on, or absorbed in, nearby surfaces can be of forensic value in post-blast analysis. As secondary ion mass spectrometry (SIMS) may be a suitable analytical approach for the screening of such residues, its performance was evaluated. METHODS The analyses were carried out in a SIMS instrument fitted with a quadrupole analyzer. The sample was sputtered at a 45° incidence angle with a 100 μm primary Ar+ beam (3 keV, 500 nA). Surface sample compensation was performed with low-energy electrons (500 eV, 0.75 mA). RESULTS TNT, RDX, PETN and cloratite were deposited in powdered form on double-sided tape and introduced into the mass spectrometer, without further handling, for SIMS analysis. The analysis conditions including compensation were optimized. A mixture of energetic compounds commonly used for explosive preparation was also analyzed, proving the potential of SIMS in forensic analysis. CONCLUSIONS This study demonstrated the possibility of detecting explosives by SIMS making use of a simple sampling procedure consisting of sticking the sample in powdered form (compatible with the collection performed in forensic post-blast analysis) onto double-sided tape without handling or preparation. Copyright © 2012 John Wiley & Sons, Ltd.","2-s2.0-84859869182"
"10.1039/c2cc34492k","https://www.scopus.com/inward/record.uri?eid=2-s2.0-84866235481&doi=10.1039%2fc2cc34492k&partnerID=40&md5=b697f1a8eb2d1ecb8b95540889188a76","A polyethylenimine polymer derivatized with pyrene moieties suitable for the fluorescence-based detection of nitroaromatic explosives (NAC) in aqueous systems is described. The system exhibits an exceptionally wide dynamic sensing range of 7 orders of magnitude (from 33 ppt to 225 ppm TNT or Tetryl). This broad range was achieved by the combination of FRET and PET sensing mechanisms in a single material. The sensing material is suitable for a paper strip assay. Simplicity, selectivity, and the wide dynamic range suggest this material for explosives detection in the field. © 2012 The Royal Society of Chemistry.","2-s2.0-84866235481"
"10.1016/j.mencom.2012.09.006","https://www.scopus.com/inward/record.uri?eid=2-s2.0-84867555220&doi=10.1016%2fj.mencom.2012.09.006&partnerID=40&md5=30344df2aeca88b61d1e2af64cff2891","The graphite-coated copper nanoparticles were synthesized by the detonation decomposition of a copper-doped emulsion explosive and their structure and chemical composition were characterized by TEM, HRTEM, EDX and XRD analysis. © 2012 Mendeleev Communications. All rights reserved.","2-s2.0-84867555220"
"10.1039/c2cc33486k","https://www.scopus.com/inward/record.uri?eid=2-s2.0-84862885713&doi=10.1039%2fc2cc33486k&partnerID=40&md5=6310538d70c082cc685e0319ba30592e","A convenient and portable triacetone triperoxide (TATP) sensor was developed utilizing a thiol-to-disulfide oxidation to trigger a solution-to-gel phase transition. Using this method, TATP can be detected visually without any instrumentation. © 2012 The Royal Society of Chemistry.","2-s2.0-84862885713"
"10.1016/j.ijmultiphaseflow.2012.02.005","https://www.scopus.com/inward/record.uri?eid=2-s2.0-84858722523&doi=10.1016%2fj.ijmultiphaseflow.2012.02.005&partnerID=40&md5=c445b1a43b4b82fe9f773caf033a9816","This study concerns the development of a mixture fraction based reaction progress variable formulation for aluminized explosives. Highlights of the formulation include a fully compressible treatment of both the gas and solid phases (both aluminum and alumina), heterogenous and homogenous reactions, and effects of group combustion. Isolated particle simulations are validated against experimental data and DNS and show good agreement of burn times over a range of pressure and oxygen environments. The new models are implemented in the CTH shock physics code using a fractional step approach to allow for efficient computation of particle dynamics. Comparisons are made to experimental pressure data for a thermobaric explosive in the Sandia Explosive Components Facility (ECF). Parametric studies are conducted to determine pressure response and impulse to charge equivalence ratio and particle size. Overall good agreement is observed between simulation predictions of pressure time history and impulse. © 2012 Elsevier Ltd.","2-s2.0-84858722523"
"10.1016/j.comptc.2012.06.028","https://www.scopus.com/inward/record.uri?eid=2-s2.0-84864922185&doi=10.1016%2fj.comptc.2012.06.028&partnerID=40&md5=773f1ed90a4bf4379d19c4355786a224","The (1:1) complexes of 1,1-diamino-2,2-dinitroethylene (FOX-7) with acetylene were studied computationally. The structure of the complexes, energies and the vibrational frequencies were computed at the HF and B3LYP levels of theory using 6-31G midast;, 6-311G midast;, 6-31++G  and 6-311++G midast; basis sets. The 1A type structure is most stable structure corresponding to N-Hpi; complex of FOX-7-acetylene. The ZPE+BSSE corrected binding energy for 1A is predicted to be -2.01kcal/mol at the B3LYP/6-311++G midast; level. To understand the pull effect on complex formation, the most stable 1A type structure were searched in 1,1-diamino-2-nitroethylene (DANE)-acetylene and 1,1-diaminoethylene (DAE)-acetylene complexes using HF and B3LYP levels using a 6-311++G midast; basis set. The 1E structure of DANE-acetylene complex is quite similar to the most stable structure of FOX-7-acetylene (1A). The absence of electron-withdrawing nitro groups in DAE results in the transformation of the structure, which makes the absence of N-Hpi; hydrogen bond in DAE(1)-acetylene. AIM analysis was also performed to understand the nature of the interactions in these complexes. © 2012.","2-s2.0-84864922185"
"10.1007/s11665-011-0098-7","https://www.scopus.com/inward/record.uri?eid=2-s2.0-84865247996&doi=10.1007%2fs11665-011-0098-7&partnerID=40&md5=f09fbd95481356a2c5beb5101d5c4713","The need for better detection of explosive devices has imposed a necessity for determining the dielectric response properties of energetic materials with respect to electromagnetic wave excitation. Among the range of different frequencies for electromagnetic excitation, the THz frequency range is of particular interest because of its nondestructive nature. The present study is based on significant progress in density functional theory (DFT), and associated software technology, which is sufficiently mature for the determination of dielectric response functions, and actually provides complementary information to that obtained from experiment. This point is further demonstrated in this study by calculations of ground state resonance structure associated with molecular clusters of the high explosives PETN and TNT using DFT, which is for the construction of parameterized dielectric response functions for excitation by electromagnetic waves at frequencies within the THz range. These dielectric functions provide for different types of analyses concerning the dielectric response of explosives. In particular, these dielectric response functions provide quantitative initial estimates of spectral response features for subsequent adjustment with respect to additional information such as laboratory measurements and other types of theory-based calculations. With respect to qualitative analysis, these spectra provide for the molecular level interpretation of response structure. The DFT software GAUSSIAN was used for the calculations of ground state resonance structure presented here. © 2012 ASM International.","2-s2.0-84865247996"
"10.1016/j.aca.2012.07.029","https://www.scopus.com/inward/record.uri?eid=2-s2.0-84865547035&doi=10.1016%2fj.aca.2012.07.029&partnerID=40&md5=60bfe03cf53d1d46abe72d6b60e33684","This study found that 1,2-ethylenediamine (EDA) as a primary amine could be modified onto the surface of citrate-stabilized gold nanoparticles (Au NPs), and the EDA-capped Au NPs were successfully used as an ultrasensitive optical probe for TNT detection. The strong donor-acceptor (D-A) interactions between EDA and trinitrotoluene (TNT) at the Au NP/solution interface induced significant aggregation of the EDA-capped Au NPs, and enabled to easily realize the direct colorimetric detection of ultratrace TNT. The results showed that such a color change was readily seen by the naked eye, and the colorimetric detection could be down to 400. pM level of TNT with excellent discrimination against other nitro compounds. UV-vis absorption spectroscopy was used to examine the TNT-induced changes in local surface plasmon resonance (LSPR) of EDA-capped Au NPs, and a new LSPR band at ca. 630. nm arose along with the addition of TNT, which produced a detection limit of TNT down to ca. 40. pM. Furthermore, dynamic light scattering measurements evidenced the ultratrace TNT-induced small changes in the size of the EDA-capped Au NPs, and realized the quick and accurate detection of TNT in 0.4. pM level. These results demonstrated the ultrahigh sensitivity of this optical probe for TNT detection. Moreover, this optical probe is sample, stable, low-cost, and these excellent properties make it quite promising for infield and rapid detection of TNT. © 2012 Elsevier B.V.","2-s2.0-84865547035"
"10.1002/prep.201100135","https://www.scopus.com/inward/record.uri?eid=2-s2.0-84871310618&doi=10.1002%2fprep.201100135&partnerID=40&md5=75a7d6582e5ebad27c2a491907dfbe3e","The burning rate pressure relationship is one of the important criteria in the selection of the propellant for particular applications. The pressure exponent (η) plays a significant role in the internal ballistics of rocket motors. Nitramines are known to produce lower burning rates and higher pressure exponent (η) values. Studies on the burning rate and combustion behavior of advanced high-energy NG/PE-PCP/AP/Al- and NG/PE-PCP/HMX/AP/Al-based solid rocket propellants processed by a conventional slurry cast route were carried out. The objective of present study was to understand the effectiveness of various ballistic modifiers viz. iron oxide, copper chromite, lead/copper oxides, and lead salts in combination with carbon black as a catalyst on the burning rate and pressure exponent of these high-energy propellants. A 7-9 % increase in the burning rates and almost no effect in pressure exponent values of propellant compositions without nitramine were observed. However, in case of nitramine-based propellants as compared to propellant compositions without nitramines, slight increases of the burning rates were observed. By incorporation of ballistic modifiers, the pressure exponents can be lowered. The changes in the calorimetric values of the formulations by addition of the catalysts were also studied. Copyright © 2012 WILEY-VCH Verlag GmbH & Co. KGaA, Weinheim.","2-s2.0-84871310618"
"10.1016/j.talanta.2012.05.058","https://www.scopus.com/inward/record.uri?eid=2-s2.0-84866104951&doi=10.1016%2fj.talanta.2012.05.058&partnerID=40&md5=e1dfbdc941435d1fee3c3160d39d9226","A method for focused ultrasonic extraction of nitroglycerin, triphenyl amine and acetyl tributyl citrate presented in double-base propellant samples following by the gas chromatography/mass spectrometry analysis was developed. A face-centered central composite design of the experiments and response surface modeling was used for optimization of the time, amplitude and sample amount. The dichloromethane was used as the extractant solvent. The optimal extraction conditions with respect to the maximum yield of the lowest abundant compound triphenyl amine were found at the 20 min extraction time, 35% amplitude of ultrasonic waves and 2.5 g of the propellant sample. The results obtained under optimal conditions were compared with the results achieved with validated Soxhlet extraction method, which is typically used for isolation and pre-concentration of compounds from the samples of explosives. The extraction yields for acetyl tributyl citrate using both extraction methods were comparable; however, the yield of ultrasonic extraction of nitroglycerin and triphenyl amine was lower than using Soxhlet extraction. The possible sources of different extraction yields are estimated and discussed. © 2012 Elsevier B.V.","2-s2.0-84866104951"
"10.1016/j.supflu.2012.09.010","https://www.scopus.com/inward/record.uri?eid=2-s2.0-84867746824&doi=10.1016%2fj.supflu.2012.09.010&partnerID=40&md5=04461f21fc8a55f6fc8ae626e721b629","Taguchi robust design was employed as a statistical optimization method to optimize parameters of SAS process in order to prepare HMX nanoparticles. The current application of the Taguchi statistical optimization was highly efficient in optimizing of experimental variables which are effective in HMX particle size produced by the SAS technique. The effect of operation conditions such as: pressure, temperature, HMX concentration, solution flow rate, solvent identification, and flow rate of CO2 on the size of micronized HMX particles under various levels was investigated. The effects of these variables on the particle size of produced HMX were quantitatively evaluated by the analysis of variance (ANOVA). The results showed that the size of HMX particles prepared by SAS technique could be tuned effectively by controlling the main parameters under their optimum level. Finally, the optimum conditions for preparation of HMX nanoparticles via SAS method were proposed. The results of ANOVA showed that 3.5 mol/l HMX concentration, 3 ml/min solution flow rate, cyclohexanone as solvent, and 70 ml/min flow rate of CO2 are optimum conditions for producing HMX nanoparticles. Experimental observations showed that under optimum conditions of SAS process, the particle size of produced HMX is about 56 nm. © 2012 Elsevier B.V.","2-s2.0-84867746824"
"10.1080/07370652.2010.550599","https://www.scopus.com/inward/record.uri?eid=2-s2.0-84858188230&doi=10.1080%2f07370652.2010.550599&partnerID=40&md5=6356c0304ffabff3ddf30d4fe9ca447d","Powdery emulsion explosive (PEE), a new powdery industrial explosive with perfect properties, has been made using an emulsification-spray drying technique. PEE is composed of 91-92.5 wt% ammonium nitrate (AN), 4.5-6 wt% organic fuels, and 1.5-1.8 wt% water. Due to its microstructure as a water-in-oil (W/O) emulsion and low water content, it has excellent detonation performance, outstanding water resistance, reliable safety, and good application compared with other industrial explosives, such as ammonite, emulsion explosives, and ANFO. © 2012 Taylor and Francis Group, LLC.","2-s2.0-84858188230"
"10.1016/j.physb.2012.05.010","https://www.scopus.com/inward/record.uri?eid=2-s2.0-84862976764&doi=10.1016%2fj.physb.2012.05.010&partnerID=40&md5=a7c1af166a7e755703f977fa8383a62f","Molecular dynamics simulation was applied to study the structure and energy properties of β-HMX (β-cyclotetramethylene tetranitramine) crystal and its composite PBXs (polymer-bonded explosives) with F 2311 as a polymer binder under different temperatures and F 2311 concentrations. The interface interaction energy of HMX and F 2311, the interaction energy E N-N between N atoms in N-NO 2 trigger bond in HMX molecules, and the cohesive energy density (CED) are presented and analyzed. A meaningful finding is that there exists correlation between E N-N and the sensitivity of β-HMX and its composites, i.e. the less the E N-N is, the larger the sensitivity is. Additionally, molecular interactions are inherently disclosed by using pair correlation function (PCF) to analyze the interfacial structure between (1 0 0)HMX crystal surface and F 2311 molecular chain. © 2012 Elsevier B.V. All rights reserved.","2-s2.0-84862976764"
"10.1007/s10973-011-1845-6","https://www.scopus.com/inward/record.uri?eid=2-s2.0-84870902355&doi=10.1007%2fs10973-011-1845-6&partnerID=40&md5=11eb7a658e9543e165debba153e3bf54","Thermal stability and decomposition kinetics for two energetic materials, potassium nitroform (KNF) and 5-Nitro-2,4-dihydro-3H-1,2,4-triazol-3-one (NTO), were investigated to obtain information on their safety for handling, storage, and use. Differential scanning calorimetry (DSC) and simultaneous thermogravimetry-differential thermal analysis (TG-DTA) techniques have been used to study thermal behavior of these energetic compounds. The results of TG analysis revealed that the main thermal degradation for the KNF occurs during two temperature ranges of 270-330 and 360-430 °C. Meanwhile, NTO decomposes completely in temperature range of 250-300 °C. TG-DTA analysis of KNF indicates that this energetic compound dehydrated (at about 108 °C) before its decomposition. However, NTO is thermally stable until its decomposition. The decomposition kinetic of energetic materials was studied by non-isothermal DSC under various heating rates. Kinetic parameters such as activation energy and frequency factor for thermal decomposition of energetic compounds were obtained via the methods proposed by ASTM E696 and Starink. Also, thermodynamic parameters correspond to the activation of thermal decomposition and critical ignition temperatures of the compounds were obtained. © Akademiai Kiado, Budapest, Hungary 2012.","2-s2.0-84870902355"
"10.1098/rspa.2011.0595","https://www.scopus.com/inward/record.uri?eid=2-s2.0-84862178731&doi=10.1098%2frspa.2011.0595&partnerID=40&md5=b62a920b141d4fa36bfcfe68f5ac69c3","For condensed explosives, containing metal particle additives, interaction of the detonation shock and reaction zone with solid inclusions leads to high rates of momentum and heat transfer that consequently introduce non-ideal detonation phenomena. During the time scale of the leading detonation shock crossing a particle, the acceleration and heating of metal particles are shown to depend on the volume fraction of particles, dense packing configuration, material density ratio of explosive to solid particles and ratio of particle diameter to detonation reaction-zone length. Dimensional analysis and physical parameter evaluation are used to formalize the factors affecting particle acceleration and heating. Three-dimensional mesoscale calculations are conducted for matrices of spherical metal particles immersed in a liquid explosive for various particle diameter and solid loading conditions, to determine the velocity and temperature transmission factors resulting from shock compression. Results are incorporated as interphase exchange source terms for macroscopic continuum models that can be applied to practical detonation problems involving multi-phase explosives or shock propagation in dense particle-fluid systems. © 2012 The Royal Society.","2-s2.0-84862178731"
"10.1002/chem.201200469","https://www.scopus.com/inward/record.uri?eid=2-s2.0-84867063887&doi=10.1002%2fchem.201200469&partnerID=40&md5=1f9e37797b9a1f4a5f97dabd54177ee3","Small-molecule fluorescent sensors (1-5) for the recognition of nitroaromatic compounds, such as 2,4-dinitrotoluene and the explosive TNT, were obtained by using a three-step dehydrohalogenation cycloaddition protocol. The interaction of the receptors and nitroaromatics was studied both in solution and in the solid state by using fluorescence spectroscopy and X-ray crystallography, respectively. It is shown that the iptycene receptors 1-5 provide a cavity suitable for binding nitroaromatic compounds in an edge-to-face mode, rather than simple ring-stacking interactions. The results obtained inspired us to develop an inexpensive, reliable and robust sensor for vapour detection of explosives. Polymer nanofibres are particularly suitable for the production of such TNT sensors as they accelerate the mass exchange between the polymer and the vapours of TNT. Quenching of the sensors took place within 1 min compared to 10 min for a glass-slide assay. Hence, the sensor performance can be improved by optimising the matrix material and morphology without resynthesising the sensor moieties. TNT is sensed! Fluorescent sensors based on the iptycene recognition motif were synthesised and studied with different nitroaromatic compounds. X-ray structures confirm the establishment of edge-to-face interactions. Fluorescence studies in solution and in polymer matrices allowed the development of polymer-nanofibre sensors for the detection of nitroaromatic compounds and TNT (see figure). Copyright © 2012 WILEY-VCH Verlag GmbH & Co. KGaA, Weinheim.","2-s2.0-84867063887"
