"DOI","Link","Abstract","EID"
"10.1016/j.proeng.2014.11.537","https://www.scopus.com/inward/record.uri?eid=2-s2.0-84923370737&doi=10.1016%2fj.proeng.2014.11.537&partnerID=40&md5=c8c86385df6649b99ddedac7f2965e61","The detection of explosives and explosive-related compounds is of major importance for the monitoring of explosivecontaminated sites. Current methods need to become cheaper and portable while maintaining a high sensitivity and selectivity level. In that sense, a silicon micro-analytical platform consisting of a three-dimensional micro-preconcentrator based on a hydrophobic zeolite, coupled to a silicon spiral micro-column was built. A chemical gas sensor acted as a miniaturized gas detector. This system allowed selective detection of orthonitrotoluene (ONT), an explosive-related compound at the sub-ppm level in the presence of toluene and moisture. © 2014 Published by Elsevier Ltd.","2-s2.0-84923370737"
"10.14233/ajchem.2014.17719","https://www.scopus.com/inward/record.uri?eid=2-s2.0-84904277484&doi=10.14233%2fajchem.2014.17719&partnerID=40&md5=01a9b1ade2a48b36f57392bee88d109d","A one-step process for the detection of an explosive was developed from tests and experimental data, and the achieved detection was based on the samples' relative elemental composition ratios. According to a self-developed computer program, collected γ-spectra by prompt γ-ray neutron activation analysis were applied to a principal component analysis to increase the signal-to-noise ratio and to discriminate the explosives from non-explosive materials. A test sample was successfully run through the program and could be detected as an explosive or a non-explosive with a reasonable error rate.","2-s2.0-84904277484"
"10.1002/prep.201300183","https://www.scopus.com/inward/record.uri?eid=2-s2.0-84905828247&doi=10.1002%2fprep.201300183&partnerID=40&md5=b4406aee545c64d5e983d055f666bcf5","Propellants containing nitroglycerine and ammonium perchlorate have been reported to have comparatively shorter shelf lives than analogous energetic materials without this oxidizer. However, investigation into the aging behavior of three compositions containing polyethylene glycol and nitroglycerine revealed that the propellant which included ammonium perchlorate degraded at a slower rate compared with the other materials. It was suggested that ammonium perchlorate might act as an oxygen inhibitor reducing the oxidation rate of the polyethylene glycol binder so decreasing the rate of the propellant decomposition. In addition, at temperatures of 80°C or lower, ammonium perchlorate initially appears to hinder acid hydrolysis of nitroglycerine which also slows down the degradation of polyethylene glycol based propellant. © 2014 WILEY-VCH Verlag GmbH & Co. KGaA, Weinheim.","2-s2.0-84905828247"
"10.1016/j.snb.2013.11.026","https://www.scopus.com/inward/record.uri?eid=2-s2.0-84890287946&doi=10.1016%2fj.snb.2013.11.026&partnerID=40&md5=d7cba14c0ae30f48ada09943e99980e5","In this study, we report a chemical sensor utilizing localized surface plasmon resonance (LSPR) of gold nanoparticles (GNP) for vapour phase detection of explosives like 2,4,6-trinitrotoluene (TNT) and cyclotrimethylenetrinitramine (RDX). The GNP were immobilized on a U-bend fibre optic sensor probe of 200 μm core diameter and bend diameter of 1.5 mm for evanescent field based excitation of localized surface plasmons of the GNP. The immobilized GNP were functionalized with receptor molecules viz. 4-mercaptobenzoic acid (4-MBA), l-cysteine and cysteamine to provide the binding sites for the nitro-based explosive molecules. Binding of the explosive analytes to the surface moieties of the GNP was found to elicit refractive index changes in the environment surrounding the nanoparticles. This led to changes in the absorbance characteristics of the GNP-LSPR spectrum. Furthermore, the GNP coated probes modified with l-cysteine and cysteamine exhibited a high degree of selectivity towards TNT. The detection limit of the LSPR fibre optic probe for TNT vapours was found to be in the lower parts per billion (ppb) with further scope for improvement. © 2013 Elsevier B.V. All rights reserved.","2-s2.0-84890287946"
"10.1117/12.2050647","https://www.scopus.com/inward/record.uri?eid=2-s2.0-84905836716&doi=10.1117%2f12.2050647&partnerID=40&md5=91655a6bb92a00cc40410665d3b91959","In order to combat the threat of emplaced explosives (land mines, etc.), ChemImage Sensor Systems (CISS) has developed a multi-sensor, robot mounted sensor capable of identification and confirmation of potential threats. The system, known as STARR (Shortwave-infrared Targeted Agile Raman Robot), utilizes shortwave infrared spectroscopy for the identification of potential threats, combined with a visible short-range standoff Raman hyperspectral imaging (HSI) system for material confirmation. The entire system is mounted onto a Talon UGV (Unmanned Ground Vehicle), giving the sensor an increased area search rate and reducing the risk of injury to the operator. The Raman HSI system utilizes a fiber array spectral translator (FAST) for the acquisition of high quality Raman chemical images, allowing for increased sensitivity and improved specificity. An overview of the design and operation of the system will be presented, along with initial detection results of the fusion sensor. © 2014 SPIE.","2-s2.0-84905836716"
"10.1117/12.2050621","https://www.scopus.com/inward/record.uri?eid=2-s2.0-84905836715&doi=10.1117%2f12.2050621&partnerID=40&md5=864bae1517fa51c9aa32cb269c039c49","We report our preliminary results on numerical modeling of IR back-scattering (reflectivity) and absorption (photothermal) IR signatures of micron-size (5-20 μm) particles. We use the Mie scattering theory which is an exact solution of the scattering problem for spherical particles of arbitrary size. In this paper, we approximate the particles as spheres with an equivalent volume. While we expect particle shape to influence IR spectra (albeit to a lesser extent), in this paper, we restrict ourselves to the effect of size (i.e. particle diameter) only. We also study the effect of air, solvent and other additive inclusions on the IR spectra. Finally, we address the effect of particle surface roughness. We show that all these parameters (size, inclusions, roughness) affect the scattering process which results in distortions to the IR spectra as compared to library values for bulk material. The effect of substrate on the IR spectra is not studied due to the limitations of the Mie scattering theory which was developed for isolated particles only. In addition to particle-related effects on IR spectra, the presence of substrate will have additional effects as well and this was studied previously by other research groups. We expect that the results of this study will help improve the performance of various detection algorithms by accounting for changing IR spectra. © 2014 SPIE.","2-s2.0-84905836715"
"10.1016/j.apsusc.2013.11.101","https://www.scopus.com/inward/record.uri?eid=2-s2.0-84893639220&doi=10.1016%2fj.apsusc.2013.11.101&partnerID=40&md5=5ebdf614edd2ea1c49791b0ac1388122","Calix(n)arenes (n = 4, 6, 8) are used as sensitive coatings for Quartz Crystal Microbalance (QCM)-based chemical sensors, and specially for the detection of dinitrotoluene as a model explosive molecule. Calix(n)arenes complex organic architectures were deposited by spray on gold-coated wafer surfaces, and DNT detection tests were performed by measuring both frequency changes and IR spectra during exposure to DNT vapours. The adsorption of DNT on calixarenes surface is proved by Polarisation Modulation Infrared Reflection-Absorption Spectroscopy (PM-IRRAS) experiments, which brings a chemical characterisation of the sensing surfaces. Kinetics of interaction of DNT with the surface was measured by QCM. When deposited onto QCM, calixarenes showed an excellent sensitivity to DNT vapours; no significant effect of the size of the cage was observed. The main drawback is the poor reversibility of these sensors, possibly due to a too strong interaction of dinitrotoluene inside the cage of the calixarenes, or to a loss of the ternary structure of these molecules, which in turn induces a loss of interaction strength with host molecules. © 2013 Elsevier B.V.","2-s2.0-84893639220"
"10.3390/s140304074","https://www.scopus.com/inward/record.uri?eid=2-s2.0-84896878738&doi=10.3390%2fs140304074&partnerID=40&md5=12a086e6b838b9a65573e1aafbb837cc","A field demonstration and longevity assessment for long-term monitoring of the explosive 2,4,6-trinitrotoluene (TNT) in a marine environment using an anti-TNT microfluidic immunosensor is described. The TNT immunosensor is comprised of a microfluidic device with 39 parallel microchannels (2.5 cm × 250 μm × 500 μm, L × W × D) fabricated in poly(methylmethacrylate) (PMMA), then chemically functionalized with antibodies possessing a high affinity for TNT. Synthesized fluorescence reporter complexes used in a displacement-based assay format were used for TNT identification. For field deployment the TNT immunosensor was configured onto a submersible moored steel frame along with frame controller, pumps and TNT plume generator and deployed pier side for intermittent plume sampling of TNT (1h increments). Under varying current and tidal conditions trace levels of TNT in natural seawater were detected over an extended period (>18 h). Overnight operation and data recording was monitored via a web interface. © 2014 by the authors; licensee MDPI, Basel, Switzerland.","2-s2.0-84896878738"
"10.1002/prep.201300020","https://www.scopus.com/inward/record.uri?eid=2-s2.0-84897599927&doi=10.1002%2fprep.201300020&partnerID=40&md5=e546b11a0f431ca5dd35f3058951906e","NEPE propellants were prematurely aged at 65, 70, 75, and 80 °C, respectively. The strength limit of NEPE propellants was tested by the uniaxial tension test. Based on the aging mechanism of the micro-phase structure and the macro-mechanical properties of NEPE propellants, the aging process was divided into three stages: post curing stage, microstructure gradual degradation stage and accelerated chemical aging stage. Because nitrate ester is hardly to decompose at ambient temperatures, the post cure of NEPE propellants only occurs at higher temperatures. Thus, the life prediction of NEPE propellants should ignore the time of post cure. The service life of NEPE propellants at ambient temperatures should be determined by the second stage of high temperature accelerated aging. By analyzing the tensile strength of NEPE propellants aged at 65, 70, 75, and 80°C, the service life prediction equation of NEPE propellants was established and the service life was predicted. Copyright © 2014 WILEY-VCH Verlag GmbH & Co. KGaA, Weinheim.","2-s2.0-84897599927"
"10.1016/j.apradiso.2014.07.010","https://www.scopus.com/inward/record.uri?eid=2-s2.0-84907312667&doi=10.1016%2fj.apradiso.2014.07.010&partnerID=40&md5=466cead45342c7df8d75f58fe446de9b","An explosive detection system based on a Deuterium-Deuterium (D-D) neutron generator has been simulated using the Monte Carlo N-Particle Transport Code (MCNP5). Nuclear-based explosive detection methods can detect explosives by identifying their elemental components, especially nitrogen. Thermal neutron capture reactions have been used for detecting prompt gamma emission (10.82MeV) following radiative neutron capture by 14N nuclei. The explosive detection system was built based on a fully high-voltage-shielded, axial D-D neutron generator with a radio frequency (RF) driven ion source and nominal yield of about 1010 fast neutrons per second (E=2.5MeV). Polyethylene and paraffin were used as moderators with borated polyethylene and lead as neutron and gamma ray shielding, respectively. The shape and the thickness of the moderators and shields are optimized to produce the highest thermal neutron flux at the position of the explosive and the minimum total dose at the outer surfaces of the explosive detection system walls. In addition, simulation of the response functions of NaI, BGO, and LaBr3-based γ-ray detectors to different explosives is described. © 2014 Elsevier Ltd.","2-s2.0-84907312667"
"10.1002/prep.201400021","https://www.scopus.com/inward/record.uri?eid=2-s2.0-84902547746&doi=10.1002%2fprep.201400021&partnerID=40&md5=5bafd74c83aa6cf5dbf7b0b5bc8a08da","In order to improve the safety of energetic compositions, whether it has to be worked with less sensitive materials that are often less powerful or with high energetic materials crystals with improved purity and microstructure quality. A way to modify the crystal quality of an energetic material is to structure the matter on the nanoscale: the crystals size reduction should induce impurity modifications in the particles. That is one of the reasons why interest in nanoenergetic compositions that contain high energetic material (≥90 wt-%) and an organic matrix (≤10 wt-%) that takes part in constraining the explosive to organize itself on the nanoscale arose. The key point is to find or synthesize the matrix. In the course of this study, first ammonium perchlorate compositions structured on the nanoscale were synthesized (150 nm AP particles (80 wt-%) dispersed in an organogel matrix (20 wt-%)). The formulation process was based on the impregnation of porous organogels with a saturated aqueous solution of ammonium perchlorate followed by freeze drying. The overall composition had an oxygen balance equilibrated towards CO 2. These AP nanocompositions show better safety behavior during combustion than there equivalent macrocompositions, while they burn more rapidly, with no degradation of their impact and thermal sensitivity properties. The formulation process of RDX nanocompositions is more complex as the solvent used is γ-butyrolactone which can not be directly frozen dried. However, first RDX nanocompositions were formulated and characterized using differential scanning calorimetry (DSC), scanning electron microscopy (SEM), X-ray powder diffraction, and drop weight impact. Lately compressions of these RDX compositions were performed, prior to gap-test experiments. © 2014 WILEY-VCH Verlag GmbH & Co. KGaA, Weinheim.","2-s2.0-84902547746"
"10.1016/j.cie.2014.06.003","https://www.scopus.com/inward/record.uri?eid=2-s2.0-84904203788&doi=10.1016%2fj.cie.2014.06.003&partnerID=40&md5=05faf3d4fe8add9cf54012e41ee5c558","The objectives of this research are to design and develop a practical decision support methodology with efficient prediction tool and risk assessment analysis of a terrorism insurgency situation. The proposed methodology consists of two main parts as: (1) the prediction modelling and (2) risk assessment analysis. The Improvised Explosive Device (IED) incidents from 2007 to 2013 in the capital district of Yala province, the southern part of Thailand, are collected and generated to the methodology as a case study implementation. The proposed methodology is capable of indicating and illustrating the risk assessment prediction results of terrorism insurgency incidents. Furthermore, the demonstration of the Explosive Ordnance Disposal Mobile Unit (EODMU) based upon a Risk Assessment Radar Chart is investigated. In practical terms of applying the proposed methodology, the Thai Government can concentrate on a critical operation zone under a Risk Assessment Radar Chart, resulting in a more accurate operation and leading to a much lower number of casualties. © 2014 Elsevier Ltd. All rights reserved.","2-s2.0-84904203788"
"10.1063/1.4861616","https://www.scopus.com/inward/record.uri?eid=2-s2.0-84892391034&doi=10.1063%2f1.4861616&partnerID=40&md5=83d49480066468c5396f91594c7d7e27","We report on our study of RDX and HMX, two of the most commonly used explosive materials, in bulk pellets with reflection terahertz time-domain spectroscopy in the frequency range of 0.3-3 THz. The maximum entropy method was utilized to correct our raw reflection data against the phase error due to the relative displacement between the sample and the reference. Both the refractive index n and the extinction coefficient k in the terahertz region were acquired for these two explosives without a Kramers-Kronig analysis. Both RDX and HMX exhibit a series of distinct peaks not quite detectable in the more conventional transmission-type measurements due to their high terahertz absorptivity. Our results are compared with the literature data on powder samples. © 2014 AIP Publishing LLC.","2-s2.0-84892391034"
"10.1166/sl.2014.3380","https://www.scopus.com/inward/record.uri?eid=2-s2.0-84919362557&doi=10.1166%2fsl.2014.3380&partnerID=40&md5=d29696d28e5b65c8747658a62ca0a889","Molecularly imprinted titania based conductometric sensor was developed for selective recognition of p-nitrophenol. Titania sol-gel layer imprinted with p-nitrophenol was synthesized and characterized for its rebinding efficiency. Fourier transform infrared spectroscopy (FTIR) studies indicated the successful imprinting of template and its subsequent removal on washing. Scanning electron microscope (SEM) images of imprinted film before and after washing showed a significant change in porosity of molecular imprinted polymer (MIP) layer i.e., favoring analyte adsorption. The conductometric response of the developed sensor was tested for p-nitrophenol in the range of 0.01-0.1 mM. Non-imprinted titania layer was evaluated to compensate the non-specific binding interactions. Selectivity studies were also conducted by exposing equimolar solutions of para, meta and ortho nitrophenol to MIP layer. Results showed that MIP layer is highly responsive towards its template p-nitrophenol as compared to other isomers. The efficiency of regenerated layer was more than 85% of fresh titania layer even after ten rounds of analyses. Finally, imprinted titania layer was fabricated with Ag-nanoparticles for improving sensor response thus, developing composite layer material for enhanced recognition. Copyright © 2014 American Scientific Publishers","2-s2.0-84919362557"
"10.1016/j.molliq.2013.12.028","https://www.scopus.com/inward/record.uri?eid=2-s2.0-84891884833&doi=10.1016%2fj.molliq.2013.12.028&partnerID=40&md5=3363597a52f347019df7b42ae16f0edf","2,4,6,8,10,12-Hexanitro-2,4,6,8,10,12-hexaazaisowurtzitane (CL-20) as one of the high energy cage nitramines has been used in various propellants and explosive formulations. The performance of energetic materials depends on its particle size and shape. Therefore, in this research, microemulsion method has been applied for the preparation of CL-20 nanoparticles via oil in water (O/W) microemulsions. The optimized formulation contains water 45%, n-butyl acetate 20.5%, sodium dodecyl sulfate (SDS, as anionic surfactant) 6.5% and 2-propanol (as co-surfactant) 26.5%. CL-20 nanoparticles that were obtained by microemulsion method are spherical with an average diameter of 25 nm, based on TEM image. CL-20 nanoparticles were also characterized by SEM image analysis, FTIR spectroscopy and TG method. © 2013 Elsevier B.V.","2-s2.0-84891884833"
"10.1002/prep.201300071","https://www.scopus.com/inward/record.uri?eid=2-s2.0-84897598711&doi=10.1002%2fprep.201300071&partnerID=40&md5=15205ff2dc7bd79eb95934fcd5da8090","The conductor-like screening model for real solvents (COSMO-RS) has previously been shown to give accurate aqueous solubilities for a range of organic compounds using only quantum chemical simulation data. Application of this method for solid organic explosives, however, faces two difficulties; it requires correction for the free energy of fusion (a generally unknown quantity for these compounds) and it shows considerable error for common explosive classes such as nitramines. Herein we introduce a correction factor for COSMO-RS that is applicable to a wide range of explosives, and requires no data beyond a quantum chemistry calculation. This modification allows COSMO-RS to be used as a predictive tool for new proposed explosives or for systems lacking experimental data. We use this method to predict the temperature-dependent solubility of solid explosives in pure and saline water to an average accuracy of approximately 0.25log units at ambient temperature. Setschenow (salting-out) coefficients predicted by this method show considerable improvement over previous COSMO-RS results, but are still slightly overestimated compared to the limited experimental data available. We apply this method to a range of military, homemade, and ""green"" explosives that lack experimental seawater solubility data, an important property for environmental fate and transport modeling. Copyright © 2014 WILEY-VCH Verlag GmbH & Co. KGaA, Weinheim.","2-s2.0-84897598711"
"10.1002/prep.201300077","https://www.scopus.com/inward/record.uri?eid=2-s2.0-84897596259&doi=10.1002%2fprep.201300077&partnerID=40&md5=5da2b29caab0631e02334f3ec93060ed","In an effort to improve the insensitive munition (IM) response but maintain performance of aluminized formulations, silicon was investigated as a possible replacement for aluminum. An RDX-based silicon explosive was developed in which nearly 90 % reaction of silicon to silicon dioxide was realized by 7 volume expansions as measured by the 2.54cm diameter copper cylinder expansion test. In spite of the low nitramine loading in the formulation (79 wt.-%), the corresponding Gurney constant for the explosive was 2.81±0.02km s -1, which is superior to Composition A-3 under the same experimental conditions (91 % RDX, 2.69±0.02km s-1). Energy calculations from detonation calorimetry also indicate reaction of the silicon, which was further confirmed by both silicon metal and silicon dioxide in the analyzed residue. The energy release, despite it being equivalent to a highly loaded explosive, was found to lag behind the rate of A-3. This indicates silicon oxidation may occur sometime after lighter gas reactions in the reaction front, but is fast enough to impart work in the copper cylinder test. Copyright © 2014 WILEY-VCH Verlag GmbH & Co. KGaA, Weinheim.","2-s2.0-84897596259"
"10.1002/prep.201300176","https://www.scopus.com/inward/record.uri?eid=2-s2.0-84905867718&doi=10.1002%2fprep.201300176&partnerID=40&md5=a0b305fc8ffaee16e1a10a9fbbd56e43","In the development of weapons, the current trend is to replace incombustible constituent elements with combustible ones. The traditional porous combustible objects are composed of nitrocellulose as energetic component, which is highly sensitive and inflammable. Formulations composed of high content RDX and inert polymer binder were employed to replace the tradional ones. This paper reports the fabrication process of microcellular combustible objects with skin-core structure using supercritical CO2 (SC-CO2) as foaming agent. The objects were foamed in designed foaming molds with expansion ratios of 1.1, 1.2 and 1.35. The influence of foaming temperature, saturation pressure, expansion ratio and RDX content on porous structure was investigated by scanning electron microscopy (SEM). Thermogravimetric analysis was conducted and the results revealed a two-stage decomposition process of RDX and binder. Performance in terms of heat resistance and moisture resistance was evaluated and compared with the traditional ones. A comparative study indicated that microcellular combustible objects are superior to traditional ones in respect of their survivability. © 2014 WILEY-VCH Verlag GmbH & Co. KGaA, Weinheim.","2-s2.0-84905867718"
"10.1002/prep.201300083","https://www.scopus.com/inward/record.uri?eid=2-s2.0-84905754513&doi=10.1002%2fprep.201300083&partnerID=40&md5=139c7993911532b4c1b78c889ae14aca","2,4-Dinitroanisole (DNAN) is an ingredient used in several insensitive munition formulations that have recently been qualified by the US Army. A phenomenon known as irreversible growth is found to occur during conditioning cycles of insensitive munitions (IM) that contain DNAN. A possible cause of the irreversible growth maybe the potential solubility of energetic components formulated with melted DNAN. This report documents methods development and procedures used to determine the solubility of energetic constituents in molten DNAN at 100°C. High performance liquid chromatography and ion chromatography were used for quantitation. Solubilities (given as g energetic per 100 g DNAN) of RDX, HMX, NTO, NQ, and AP were found as 13.7, 3.02, 0.222, 0.448, and 0.088, respectively. © 2014 WILEY-VCH Verlag GmbH & Co. KGaA, Weinheim.","2-s2.0-84905754513"
"10.1109/MePhoCo.2014.6866454","https://www.scopus.com/inward/record.uri?eid=2-s2.0-84906871909&doi=10.1109%2fMePhoCo.2014.6866454&partnerID=40&md5=3b1dc65056c0c4a8f3c134457d9a9427","This paper deals with the presentation of the recent development of a stand-off laser Raman apparatus to monitor explosive traces dispersed on fabrics. The system has been designed to operate in compliance with the international eye-safe regulations and therefore to be installed, in the future, in public facilities check-points (e.g. mass transit check points). The particular high sensitivity reached in the detection of traces is due to the specific optical design and electro-optics components adopted. The sensor was successively, successfully integrated in a network of sensors (System of the Systems) and tested in a real environment (a Metro station in Paris). © 2014 IEEE.","2-s2.0-84906871909"
