"DOI","Link","Abstract","EID"
"10.1063/1.4896255","https://www.scopus.com/inward/record.uri?eid=2-s2.0-84908322011&doi=10.1063%2f1.4896255&partnerID=40&md5=79e8ab21ef78c3273cf5540e5cdd83f2","In this work, a graphene based strain sensor has been reported for explosive vapour detection applications by exploiting the piezoresistive property of graphene. Instead of silicon based cantilevers, a low cost polymeric micro-cantilever platform has been used to fabricate this strain sensor by embedding the graphene nanoplatelet layer inside the beam. The fabricated devices were characterized for their mechanical and electromechanical behaviour. This device shows a very high gauge factor which is around ∼144. Also the resonant frequency of these cantilevers is high enough such that the measurements are not affected by environmental noise. These devices have been used in this work for reliable detection of explosive vapours such as 2,4,6-Trinitrotoluene down to parts-per-billion concentrations in ambient conditions. © 2014 AIP Publishing LLC.","2-s2.0-84908322011"
"10.1039/c4ra11314d","https://www.scopus.com/inward/record.uri?eid=2-s2.0-84919663872&doi=10.1039%2fc4ra11314d&partnerID=40&md5=25664dca6927095c9e2b961663d56c3d","The adsorption characteristics of explosive molecules: RDX, TATP, HMTD, TNT, HMX and PETN with boron nitride (BN) and graphene (G) flakes have been investigated using first principles density functional theory (DFT). It has been found that the binding between BN flakes and the explosive molecules is stronger than that with G flakes due to higher charge transfer in the BN-complexes. The energy decomposition analysis indicates that the dispersive interaction is the most dominant one. The optical properties and the nature of electronic transitions of BN and G-explosive complexes are studied by time dependent DFT (TD-DFT). It is observed that the strong interaction with BN flakes quenches the optical spectra by a significant amount whereas the graphene flakes leave the spectra almost unperturbed. Our findings of differential characteristics of 2D flakes will be useful for the designing of nanomaterials for the detection of aromatic and nonaromatic explosive molecules. © The Royal Society of Chemistry 2015.","2-s2.0-84919663872"
"10.13182/NT11-125","https://www.scopus.com/inward/record.uri?eid=2-s2.0-84912558502&doi=10.13182%2fNT11-125&partnerID=40&md5=a55293710541fdd75dac030e28290ffb","Fast neutron interrogation for explosives detection has shown potential for the screening of sea-land cargo containers. Simulations were completed investigating the neutron scatter behavior of 14.1-MeV fast neutrons in such screening scenarios. Earlier efforts centered on Monte Carlo (MCNP5) simulations to identify flags or on specific calculations based on photons or neutrons produced as a result of fast neutron interaction that signal the presence of the explosive RDX (C2H6N6O6). Those simulations consisted of simplified target geometry; artificially collimated neutron source; and generalized organic, hydrogenous, or metallic types of cargo materials. In this study, the MCNP5 simulation was expanded to include a more accurate representation of the neutron source, target geometry, detector response, and realistic and varied container contents. The flags found using the earlier simulations were applied to the more realistic scenario models in order to determine the feasibility of the use of flags in a detection algorithm. Additional flags utilizing the simulated detector response were also investigated. The conditions under which specific flags were preferable were also examined. It was found that many flags performed well independent of the cargo type while others, such as those using only neutron backscatter, were more highly dependent on cargo type. Furthermore, many of the best-performing flags were those that did not require stringent neutron spectroscopy and would therefore be feasible with existing technology.","2-s2.0-84912558502"
"10.1002/prep.201400008","https://www.scopus.com/inward/record.uri?eid=2-s2.0-84912015786&doi=10.1002%2fprep.201400008&partnerID=40&md5=5e45a982d04b119a625ae5e646feebd9","A novel experiment developed for researching the initial collapse of an aluminum shaped charge liner was designed, executed, and validated. The experiment evolved from the need to recover shocked liner material to enable the analysis of relationships between microstructure and early liner collapse behavior. The research required material that had been shocked, yet was sufficiently intact to allow for metallurgical examination. Additionally, the experiment was designed to replicate the unique shock loading of shaped charge liners. Practically, the experiment had to be inexpensive to perform. The paper describes the experimental design, execution and validation and presents practical examples of the utility of the output. The experimental design is based on recreating a unique shock front, halting the deformation within a few microseconds and recovering material suitable for examination. Validation of the experiment employs a combination of available hydrocode modeling data and shaped charge liner collapse theory. The data collection supporting the validation was performed with computed tomography (CT) and laser generated 3D imagery. The output is recovered material valid for study. © 2014 Wiley-VCH Verlag GmbH & Co. KGaA, Weinheim.","2-s2.0-84912015786"
"10.1021/ac403062y","https://www.scopus.com/inward/record.uri?eid=2-s2.0-84901274448&doi=10.1021%2fac403062y&partnerID=40&md5=5ce42232eb6c2d43430cda89f29f914e","A new microfluidic paper-based analytical device (μPAD) in conjunction with confirmation by a lab on chip analysis was developed for detection of three trinitro aromatic explosives. Potassium hydroxide was deposited on the μPADs (0.5 μL, 1.5 M), creating a color change reaction when explosives are present, with detection limits of approximately 7.5 ± 1.0 ng for TNB, 12.5 ± 2.0 ng for TNT and 15.0 ± 2.0 ng for tetryl. For confirmatory analysis, positive μPADs were sampled using a 5 mm hole-punch, followed by extraction of explosives from the punched chad in 30 s using 20 μL borate/SDS buffer. The extractions had efficiencies of 96.5 ± 1.7%. The extracted explosives were then analyzed with the Agilent 2100 Bioanalyzer lab on a chip device with minimum detectable amounts of 3.8 ± 0.1 ng for TNB, 7.0 ± 0.9 ng for TNT, and 4.7 ± 0.2 ng for tetryl. A simulated in-field scenario demonstrated the feasibility of coupling the μPAD technique with the lab on a chip device to detect and identify 1 μg of explosives distributed on a surface of 100 cm2. © 2014 American Chemical Society.","2-s2.0-84901274448"
"10.1016/j.trac.2014.09.007","https://www.scopus.com/inward/record.uri?eid=2-s2.0-84919817075&doi=10.1016%2fj.trac.2014.09.007&partnerID=40&md5=4c6cb4943950719b9c177e4cc4b8daba","Ultrasensitive, low-cost detection of nitroaromatic explosives has attracted tremendous attention due to their great significance in homeland and international security, environmental assays, and forensics applications. Nanomaterial-based luminescence is a powerful tool in the development of highly selective analytical methods for the detection of nitroaromatic explosives. We critically examine and comment on the current diverse methodologies, principles and techniques for detection of nitroaromatic explosives based on the luminescence of nanomaterials. We provide a comprehensive discussion of the status, advancements, unparalleled challenges and future directions of this field. © 2014 Elsevier B.V..","2-s2.0-84919817075"
"10.1002/prep.201400058","https://www.scopus.com/inward/record.uri?eid=2-s2.0-84912047279&doi=10.1002%2fprep.201400058&partnerID=40&md5=be84bbe2f0ed74fe69c37355b0f57158","A previous paper by the author [1] showed how his equation [2], based on the model first proposed by Gurney [3] for the blast impulse from cased munitions, can be modified to allow for the yield stress of the casing metal. This paper [1] also provided validation for this further equation from available experimental data. Further issues regarding the many smaller but significant interactions between the fracturing casing and the expanding gases need to be investigated before it can be said that a complete theory of blast impulse and fragment initial velocity is in place. In this paper, an approximate evaluation will be made of the potential effect and significance of kinetic energy losses, due to dissipation by means of casing strain energy dissipation. As expected, these losses are found to be most significant for thick, low density, high yield stress casings. The effect of finite casing thickness, also not previously considered, has been found to be small. © 2014 Wiley-VCH Verlag GmbH & Co. KGaA, Weinheim.","2-s2.0-84912047279"
"10.1016/j.inoche.2014.02.003","https://www.scopus.com/inward/record.uri?eid=2-s2.0-84897717303&doi=10.1016%2fj.inoche.2014.02.003&partnerID=40&md5=623f35082e290c6cebea1f8d1c62cfcc","The first metal-organic 5-nitrotetrazolate, [Me3Sn(μ-OH) SnMe3(μ-OH)SnMe3(H2O)][NT] (2), has been prepared by a simple metathetical reaction between Me3SnCl and sodium 5-nitrotetrazolate dihydrate (= NaNT, 1). A single-crystal X-ray diffraction study revealed the presence of the trinuclear [Me3Sn(μ-OH) SnMe3(μ-OH)SnMe3(H2O)]+ cation to which the 5-nitrotetrazolate anion is coordinated via a ring-N atom. The NT anion is further engaged in four different OHâ̄N and OHâ̄N hydrogen bonds involving the remaining three ring-nitrogen atoms and one oxygen of the nitro group, leading to an extensive supramolecular hydrogen-bonded network in the solid state. Despite its very low N content of only 10.65%, compound 2 is highly impact-sensitive (< 2.5 J) and can be classified as a primary explosive. © 2014 Elsevier B.V.","2-s2.0-84897717303"
"10.1016/j.phpro.2015.08.370","https://www.scopus.com/inward/record.uri?eid=2-s2.0-84941659093&doi=10.1016%2fj.phpro.2015.08.370&partnerID=40&md5=f11d136bc2150f83a511f47c9ac0e4ab","In this work comparison of the desorption effectiveness of picosecond and nanosecond laser sources ( = 266, 532 nm) were carried out to investigate the possibility of creating a non-contact sampling device for detectors of explosives on the principles of ion mobility spectrometry (IMS) and field asymmetric ion mobility spectrometry (FAIMS). The results of mass spectrometric studies of TNT (2,4,6-Trinitrotoluene), HMX (octahydro-1,3,5,7-tetranitro-1,3,5,7-tetrazocine), RDX (1,3,5-Trinitro-1,3,5-triazacyclohexane) laser desorption from a quartz substrate are presented. It is shown that the most effective laser source is a Nd:YAG3+ laser ( = 266 nm; E = 1 mJ; = 5-10 ns; q = 108 W/cm2). The typical desorbed mass is 2 ng for RDX, 4-6 ng for TNT and 0.02 ng HMX per single laser pulse. The results obtained make it possible to create a non-contact portable laser sampling device operating in frequency mode with high efficiency. © 2015 The Authors.","2-s2.0-84941659093"
"10.1111/1556-4029.12558","https://www.scopus.com/inward/record.uri?eid=2-s2.0-84921409009&doi=10.1111%2f1556-4029.12558&partnerID=40&md5=e2a5e9a7c5b0bb701ce2f4c9127be66e","Glass surfaces were modified with a combination of dyes and reagents to allow for the potential simultaneous recording of a detailed fingerprint and the detection of the explosive urea nitrate (UN), as a proof of principle of surface modification for simultaneous linking of identity to manipulation of explosives. By coating microscope slides with 9,10-diphenylanthracene (DPA), p-dimethylaminobenzaldehyde (p-DMAB) and p-dimethylaminocinnamaldehyde (p-DMAC), a colorimetric change was observed in the presence of UN, while revealing a fingerprint with enough resolution to isolate at least 10 minutiae. This is the first step in creating point-of-care devices capable of detecting low concentrations of explosives and drug metabolites and connecting them to a fingerprint. © 2014 American Academy of Forensic Sciences.","2-s2.0-84921409009"
"10.1038/srep06631","https://www.scopus.com/inward/record.uri?eid=2-s2.0-84930673694&doi=10.1038%2fsrep06631&partnerID=40&md5=16936dec2000e60b6dbb5f36d3e0b783","New techniques for the field detection of inorganic improvised explosive devices (IEDs) are urgently developed. Although ion mobility spectrometry (IMS) has been proved to be the most effective method for screening organic explosives, it still faces a major challenge to detect inorganic explosives owing to their low volatilities. Herein, we proposed a strategy for detecting trace inorganic explosives by thermal desorption ion mobility spectrometry (TD-IMS) with sample-to-sample analysis time less than 5 s based on in-situ acidification on the sampling swabs. The responses for typical oxidizers in inorganic explosives, such as KNO3, KClO3 and KClO4 were at least enhanced by a factor of 3000 and their limits of detection were found to be subnanogram. The common organic explosives and their mixtures with inorganic oxidizers were detected, indicating that the acidification process did not affect the detection of organic explosives. Moreover, the typical inorganic explosives such as black powders, firecrackers and match head could be sensitively detected as well. These results demonstrated that this method could be easily employed in the current deployed IMS for on-site sensitive detection of either inorganic explosives or organic ones.","2-s2.0-84930673694"
"10.1016/j.phpro.2015.09.147","https://www.scopus.com/inward/record.uri?eid=2-s2.0-84960920387&doi=10.1016%2fj.phpro.2015.09.147&partnerID=40&md5=1755ce25746188e1673af9871f7e91ae","Nowadays surface assisted laser desorption/ionization is widely used in different analytical methods. Some of the most interest methods are based on laser irradiation of nanostructured surfaces, porous silicon (pSi) in particular. This method already proved itself in mass spectrometry due to the combination of high sensitivity and possibility of investigation of small molecules because of the absence of the influence of a substrate on the ion signal. In this work we present summarized results of our investigations dedicated to the use of the surface assisted laser desorption/ionization on pSi in ion mobility spectrometry (IMS), which is one of the most promising analytical methods in the area of fast detection of low concentrations of organic molecules. We use trinitrotoluene (TNT) as a substance to be investigated. Obtained results show that TNT ionization mechanism under laser irradiation is complicated and relates both to the electron emission process from the pSi surface and subsequent ion-molecular reactions in gas phase and to the surface proton transfer as well. © 2015 The Authors.","2-s2.0-84960920387"
"10.1039/c4ra12966k","https://www.scopus.com/inward/record.uri?eid=2-s2.0-84919724944&doi=10.1039%2fc4ra12966k&partnerID=40&md5=fd897f4fe8b85186646f33fb8caf8ca7","A fluorescent diphenylfluorene-pyrenyl copolymer with dibenzothiophene-S,S-dioxide (SO) and adamantane units has been successfully synthesized via a Suzuki-Miyaura cross-coupling reaction. After studying the sensing properties of a series of diphenylfluorene-pyrenyl materials towards TNT vapor, it was found that the dibenzothiophene-S,S-dioxide (SO) units introduced into the diphenylfluorenepyrenyl copolymers can simultaneously enhance the photostability and sensing performance of the fluorescent sensing materials. This simple strategy can be used as a promising approach for the development of fluorescent conjugated sensing materials. © The Royal Society of Chemistry 2015.","2-s2.0-84919724944"
"10.1016/j.jhazmat.2014.05.077","https://www.scopus.com/inward/record.uri?eid=2-s2.0-84902678416&doi=10.1016%2fj.jhazmat.2014.05.077&partnerID=40&md5=591f46c6cca429e76c757b39de195f1a","Five liters of sodium hypochlorite aqueous solution (12mass%) was poured into 300L of liquid waste containing ammonium ion of about 1.8mol/L in a 500 L tank in a plant area; then, two minutes later the solution exploded with a flash on March 30th, 2005. The tank cover, the fluorescent lamp and the air duct were broken by the blast wave. Thus, we have conducted 40 runs of laboratory-scale explosion tests under various conditions (solution concentrations of (NH4)2SO4 and NaClO, temperatures, Pt catalysts, pH, etc.) to investigate the causes for such an explosion. When solutions of ammonium sulfate and sodium hypochlorite are mixed in the presence of platinum black, explosions result. This is ascribable to the formation of explosive nitrogen trichloride (NCl3). In the case where it is necessary to mix these 2 solutions (ammonium sulfate and sodium hypochlorite) in the presence of platinum black, the following conditions would reduce a probability of explosion; the initial concentration of NH4+ should be less than 3mol/L and the pH should be higher than 6. The hypochlorite solution (in 1/10 in volume) to be added at room temperature is recommended to be less than 0.6mol/L. © 2014 Elsevier B.V.","2-s2.0-84902678416"
"10.15446/dyna.v81n187.40520","https://www.scopus.com/inward/record.uri?eid=2-s2.0-84908314056&doi=10.15446%2fdyna.v81n187.40520&partnerID=40&md5=e30e751db9afa86a9ee022bab54d07de","The conditions of explosive atmospheres and accumulation of gases within underground coal mines require a detailed analysis and the development of models and mechanisms that allow their detection. For this purpose we have developed the software AtmosXp V2.0 which includes the diagram of Coward for the analysis of these explosive mixtures. © The author; licensee Universidad Nacional de Colombia.","2-s2.0-84908314056"
"10.1007/s00216-014-8240-7","https://www.scopus.com/inward/record.uri?eid=2-s2.0-84913580405&doi=10.1007%2fs00216-014-8240-7&partnerID=40&md5=a3837322659e6d4b397fcd0fdd09126a","Genuine explosive materials are traditionally employed in the training and testing of explosive-detecting canines so that they will respond reliably to these substances. However, challenges arising from the acquisition, storage, handling, and transportation of explosives have given rise to the development of ""pseudo-explosive"" training aids. These products attempt to emulate the odor of real explosives while remaining inert. Therefore, a canine trained on a pseudo-explosive should respond to its real-life analog. Similarly, a canine trained on an actual explosive should respond to the pseudo-explosive as if it was real. This research tested those assumptions with a focus on three explosives: single-base smokeless powder, 2,4,6-trinitrotoluene (TNT), and a RDX-based plastic explosive (Composition C-4). Using gas chromatography-mass spectrometry with solid phase microextraction as a pre-concentration technique, we determined that the volatile compounds given off by pseudo-explosive products consisted of various solvents, known additives from explosive formulations, and common impurities present in authentic explosives. For example, simulated smokeless powders emitted terpenes, 2,4-dinitrotoluene, diphenylamine, and ethyl centralite. Simulated TNT products emitted 2,4- and 2,6-dinitrotoluene. Simulated C-4 products emitted cyclohexanone, 2-ethyl-1-hexanol, and dimethyldinitrobutane. We also conducted tests to determine whether canines trained on pseudo-explosives are capable of alerting to genuine explosives and vice versa. The results show that canines trained on pseudo-explosives performed poorly at detecting all but the pseudo-explosives they are trained on. Similarly, canines trained on actual explosives performed poorly at detecting all but the actual explosives on which they were trained. © 2014 Springer-Verlag Berlin Heidelberg.","2-s2.0-84913580405"
"10.1002/prep.201400041","https://www.scopus.com/inward/record.uri?eid=2-s2.0-84911969869&doi=10.1002%2fprep.201400041&partnerID=40&md5=509724f5f1183934b611de0698206528","A new method for the preparation of tetranitroglycoluril (TNGU, Sorguyl) is described, in which imidazo- [4,5-d]-imidazoles are nitrated with the elimination of N2O to generate TNGU. This method of TNGU synthesis results in material that is less sensitive than material produced with alternative routes. Additionally, a new spherical morphology of TNGU is disclosed. This morphology exhibits an even higher resistance to external insult even than material synthesized with the new method. © 2014 Wiley-VCH Verlag GmbH & Co. KGaA, Weinheim.","2-s2.0-84911969869"
"10.1016/j.electacta.2013.11.067","https://www.scopus.com/inward/record.uri?eid=2-s2.0-84899417362&doi=10.1016%2fj.electacta.2013.11.067&partnerID=40&md5=1c4b09057397aa54eb414b8daf31379a","Screen printed carbon electrodes (SPCE), produced close to industrial manufacturing processes as well as commercially available electrodes using nano-tubes and gold nano-particles (DRP-110CNT-GNP) were investigated with respect to the determination of nitroaromatic compounds like 2,4,6-trinitrotoluene (TNT) and 2,4-dinitrotoluene (DNT) in aqueous solution. Dynamic electrochemical measuring methods such as differential pulse voltammetry (DPV) and square wave voltammetry (SWV) are suited to measure traces of such compounds. The two peaks obtained can be separated clearly and assigned to the reduction of nitro groups. On bare carbon electrodes TNT and DNT could be determined in the concentration range between 1.2 ppb and 1500 ppb TNT (R 2 = 0.994) with high reproducibility. The coating of commercial electrodes with carbon nano-tubes and gold nano-particles provided similar results for comparison purposes. The reproducibility of the results obtained on SPCE was demonstrated over a period of up to 1.5 years. The results were verified by gas chromatography with mass spectrometry (GC-MS). © 2013 Elsevier Ltd.","2-s2.0-84899417362"
"10.1002/jms.3518","https://www.scopus.com/inward/record.uri?eid=2-s2.0-84921518246&doi=10.1002%2fjms.3518&partnerID=40&md5=166712f0843fa2b39ac6e05e0a53857c","High-field asymmetric waveformionmobility spectrometry (FAIMS) separates ions by utilizing the characteristics of nonlinear ion mobility at high and low electric fields. Accurate ion discrimination depends on the precise solution of nonlinear relationships and is essential for accurate identification of ion species for applications. So far, all the nonlinear relationships of ionmobility obtained are based at low electric fields (E/N <65 Td). Microchip FAIMS (μ-FAIMS) with small dimensions has high electric field up to E/N= 250 Td, making the approximation methods and conclusions for nonlinear relationships inappropriate for these systems. In this paper, we deduced nonlinear functions based on the first principle and a general model. Furthermore we considered the hydrodynamics of gas flow through microchannels. We then calculated the specific alpha coefficients for cocaine, morphine, HMX, TNT and RDX, respectively, based on their FAIMS spectra measured by μ-FAIMS system at ultra-high fields up to 250 Td. The results show that there is no difference in nonlinear alpha functions obtained by the approximation and new method at low field (<120 Td), but the error induced by using approximation method increases monotonically with the increase in field, and could be as much as 30% at a field of 250 Td. Copyright © 2015 John Wiley & Sons, Ltd.","2-s2.0-84921518246"
"10.1016/j.aca.2015.01.029","https://www.scopus.com/inward/record.uri?eid=2-s2.0-84941758052&doi=10.1016%2fj.aca.2015.01.029&partnerID=40&md5=a0882c94192c00a0b8b1993562053bab","A pyrene-based small molecular weight probe, exhibiting aggregation enhanced excimer emission has been synthesized. The crystalline emissive form detects 2,4,6-trinitrophenol (picric acid) at parts-perbillion concentration in solution and as low as 0.46 attogram in direct contact mode, operating predominantly in a static quenching mechanism, proposed on the basis of steady state and life-time fluorescence measurements. © 2015 Elsevier B.V. All rights reserved.","2-s2.0-84941758052"
"10.1039/c4ra15304a","https://www.scopus.com/inward/record.uri?eid=2-s2.0-84921638157&doi=10.1039%2fc4ra15304a&partnerID=40&md5=e3e0df1c4b45902da7893ae5303cfa07","This work reports the utilization of water dispersible terbium (Tb3+) doped spherical LaF3 nanoparticles (∼5 nm) surface functionalised with p-aminobenzoic acid (pABA) for the detection of aromatic nitro explosives. The functionalised nanoparticles show remarkable sensitivity to a number of highly electron deficient aromatic nitro compounds like picric acid (PA), 2,4,6-trinitrotoluene (TNT), 2,4-dinitrotoluene (2,4-DNT), 2,4-dinitrophenol (2,4-DNP) etc. All of these nitro compounds can be detected easily at ppm level using this luminescence quenching technique whereas in the case of TNT it can detect concentrations as low as 50 ppb. This novel approach of utilising the Tb3+ doped NPs sensitised by pABA has potential application in the detection of explosive materials. © The Royal Society of Chemistry 2015.","2-s2.0-84921638157"
"10.1002/prep.201300098","https://www.scopus.com/inward/record.uri?eid=2-s2.0-84911954425&doi=10.1002%2fprep.201300098&partnerID=40&md5=2b2afda7faa48f5198b740fe159c40d8","Guanylurea dinitramide (GUDN), a stable salt of dinitramidic acid has good thermal stability and is a potential candidate for insensitive munitions. The synthesis process involves nitration of the ammonium salt of sulfamic acid with conc. HNO3/H2SO4 at 20°C to 50°C and further treatment with an aqueous suspension of guanylurea sulfate to obtain GUDN as white crystalline solid in 50% yield. In order to optimize the process parameters to get the product in higher yield and greater purity, a systematic study with variation of different parameters like molar ratio of nitrating mixture, conditioning time, and temperature was carried out. © 2014 Wiley-VCH Verlag GmbH & Co. KGaA, Weinheim.","2-s2.0-84911954425"
