"DOI","Link","Abstract","EID"
"10.1007/s00216-010-4114-9","https://www.scopus.com/inward/record.uri?eid=2-s2.0-78650173276&doi=10.1007%2fs00216-010-4114-9&partnerID=40&md5=5e2c75390716486ae976b54171be0421","Relying on recent developments in proton transfer reaction mass spectrometry (PTR-MS), we demonstrate here the capability of detecting solid explosives in air and in water in real time. Two different proton transfer reaction mass spectrometers have been used in this study. One is the PTR-TOF 8000, which has an enhanced mass resolution (m/Δm up to 8,000) and high sensitivity (~50 cps/ppbv). The second is the high-sensitivity PTR-MS, which has an improved limit of detection of about several hundreds of parts per quadrillion by volume and is coupled with a direct aqueous injection device. These instruments have been successfully used to identify and monitor the solid explosive 2,4,6-trinitrotoluene (TNT) by analysing on the one hand the headspace above small quantities of samples at room temperature and from trace quantities not visible to the naked eye placed on surfaces (also demonstrating the usefulness of a simple pre-concentration and thermal desorption technique) and by analysing on the other hand trace compounds in water down to a level of about 100 pptw. The ability to identify even minute amounts of threat compounds, such as explosives, particularly within a complex chemical environment, is vital to the fight against crime and terrorism and is of paramount importance for the appraisal of the fate and harmful effects of TNT at marine ammunition dumping sites and the detection of buried antipersonnel and antitank landmines. [Figure not available: see fulltext.] © 2010 Springer-Verlag.","2-s2.0-78650173276"
"10.1021/ac201075e","https://www.scopus.com/inward/record.uri?eid=2-s2.0-79959207473&doi=10.1021%2fac201075e&partnerID=40&md5=b8055cc1da139c8bb6960eea5eba1db0","[No abstract available]","2-s2.0-79959207473"
"10.1016/j.forsciint.2010.10.010","https://www.scopus.com/inward/record.uri?eid=2-s2.0-79953058426&doi=10.1016%2fj.forsciint.2010.10.010&partnerID=40&md5=5ffa79d1b2297e46e9096bbbec3219c9","Stability of raw TATP (3,3,6,6,9,9-hexamethyl-1,2,4,5,7,8-hexoxonane) samples in solutions of common solvents was studied to highlight problems faced by forensic labs in identification and analysis of organic peroxide samples. The TATP samples were prepared by reaction of acetone and hydrogen peroxide (30%) with the aid of following catalysts: hydrochloric, sulfuric, nitric, perchloric and methanesulfonic acid. Acetone, acetonitrile, methanol and acetonitrile/water solutions of TATP samples were prepared and stored at 50°C. Various degrees of stability were observed for particular combination of catalyst and solvent ranging from totally unstable (catalyst-H2SO4/any solvent) to very stable (catalyst-HCl/solvent acetonitrile). Purification of crude TATP by re-crystallization results in product stable in all investigated solvents. Stability of solution prepared from re-crystallized DADP (3,3,6,6-tetramethyl-1,2,4,5-tetroxane) was found to be on the same level as the stability of solution of re-crystallized TATP. © 2010 Elsevier Ireland Ltd.","2-s2.0-79953058426"
"10.1016/j.nima.2010.03.093","https://www.scopus.com/inward/record.uri?eid=2-s2.0-77957970701&doi=10.1016%2fj.nima.2010.03.093&partnerID=40&md5=499bac4d84e9ed1afc9ba0254dad721a","An emerging and important topic of interest in the field of homeland security is the identification and quantification of explosives. This paper brings new elements in the Laser Photoacoustic Spectroscopy (LPAS) based characterisation of some classical explosives (2,4-DNT; 2,6-DNT; HMX; TATP; PETN) in solid phase at CO2 laser wavelengths, not yet reported in the literature to our knowledge. Moreover, we report our LPAS analysis of TNT and RDX, already previously studied with the same technique in the same spectral interval by different authors. The reported photoacoustic signals from standard commercial samples of the classical explosive substances were recorded in the 911 μm region, by a CO2 laser based homemade optical apparatus. The underlying experimental activity was performed in the molecular spectroscopy laboratory of the ENEA Research Centre in Frascati. © 2010 Elsevier B.V. All rights reserved.","2-s2.0-77957970701"
"10.1016/j.jhazmat.2010.08.049","https://www.scopus.com/inward/record.uri?eid=2-s2.0-77957876484&doi=10.1016%2fj.jhazmat.2010.08.049&partnerID=40&md5=07525570f708177c541d71f8d7d31851","A metal-free catalytic system with N,N′,N″-trihydroxyisocyanuric acid (THICA) as the catalyst for the oxidation of nitrotoluenes is introduced, and a novel Pd-free approach for the synthesis of THICA was developed. In a solution of acetic acid, THICA and concentrated nitric acid, nitrotoluenes especially polynitrotoluenes such as 2,4,6-trinitrotoluene (TNT), were converted into the desired carboxylic acids under 0.2MPa of O2 at 100°C with yields up to 99%. THICA was synthesized from N-hydroxyphtalimide through a four-step synthesis in a total yield of 46%. A possible mechanism of this catalytic process was proposed where NO2 and nitric acid first induced a radical of THICA, which then abstracts a hydrogen atom from the methyl on the aromatic ring to form a benzyl radical. This radical then initiates subsequent reactions. The production of the benzyl radical was supported by ESR measurements. © 2010.","2-s2.0-77957876484"
"10.1016/j.nima.2010.08.023","https://www.scopus.com/inward/record.uri?eid=2-s2.0-77958478616&doi=10.1016%2fj.nima.2010.08.023&partnerID=40&md5=b5402d248c98768213b12a1e6293a458","To detect the presence of explosives in packages, automated systems are required. Energy dispersive X-ray diffraction (EDXRD) represents a powerful non-invasive tool providing information on the atomic structure of samples. In this paper, EDXRD is investigated as a suitable technique for explosive detection and identification. To this end, a database has been constructed, containing measured X-ray diffraction spectra of several explosives and common materials. In order to quantify spectral resolution influence, this procedure is repeated with two different detectors which have different spectral resolution. Using our database, some standard spectrum analysis procedures generally used for this application have been implemented. Regarding to the results, it is possible to conclude on the robustness and the limits of each analysis procedure. The aim of this work is to define a robust and efficient sequence of EDXRD spectra analysis to discriminate explosive substances. Since our explosive substances are crystalline, the first step consists in using characteristic of the spectrum to estimate a crystallinity criterion which allows to remove a large part of common materials. The second step is a more detailed analysis, it consists in using similarity criterion and major peaks location to differentiate explosive from crystalline common materials. The influence of the spectral resolution on the detection is also examined. © 2010 Elsevier B.V. All rights reserved.","2-s2.0-77958478616"
"10.1088/0957-4484/21/31/315502","https://www.scopus.com/inward/record.uri?eid=2-s2.0-77957317475&doi=10.1088%2f0957-4484%2f21%2f31%2f315502&partnerID=40&md5=e004a9da0040ce2462eff25aff46e591","Triacetone triperoxide (TATP) is one of the most sensitive known explosives and can be easily synthesized using the commonly available chemicals acetone and hydrogen peroxide, but is difficult to be detected. In this study, In 2O3 nanoparticles were synthesized by a glucose-assisted solvothermal method at 120 °C for 18 h. The gas sensor based on In 2O3 nanoparticles exhibits a high response, fast response and recovery, a wide detecting range of 0.50-500 mg, good stability and excellent stability to TATP. © 2010 IOP Publishing Ltd.","2-s2.0-77957317475"
"10.1016/j.chemosphere.2011.04.066","https://www.scopus.com/inward/record.uri?eid=2-s2.0-79960566376&doi=10.1016%2fj.chemosphere.2011.04.066&partnerID=40&md5=5e86f4ef9402f4eba94981a38d771f7f","Composition B (Comp B) is a commonly used military formulation composed of the toxic explosive compounds 2,4,6-trinitrotoluene (TNT), and hexahydro-1,3,5-trinitro-1,3,5-triazine (RDX). Numerous studies of the temporal fate of explosive compounds in soils, surface water and laboratory batch reactors have been conducted. However, most of these investigations relied on the application of explosive compounds to the media via aqueous addition and thus these studies do not provide information on the real world loading of explosive residues during detonation events. To address this we investigated the dissolution and sorption of TNT and RDX from Comp B residues loaded to pure mineral phases through controlled detonation. Mineral phases included nontronite, vermiculite, biotite and Ottawa sand (quartz with minor calcite). High Performance Liquid Chromatography and Attenuated Total Reflectance Fourier Transform Infrared spectroscopy were used to investigate the dissolution and sorption of TNT and RDX residues loaded onto the mineral surfaces. Detonation resulted in heterogeneous loading of TNT and RDX onto the mineral surfaces. Explosive compound residues dissolved rapidly (within 9. h) in all samples but maximum concentrations for TNT and RDX were not consistent over time due to precipitation from solution, sorption onto mineral surfaces, and/or chemical reactions between explosive compounds and mineral surfaces. We provide a conceptual model of the physical and chemical processes governing the fate of explosive compound residues in soil minerals controlled by sorption-desorption processes. © 2011.","2-s2.0-79960566376"
"10.1021/ac1005926","https://www.scopus.com/inward/record.uri?eid=2-s2.0-77954199846&doi=10.1021%2fac1005926&partnerID=40&md5=53b0561e80d985d39eef84f45f9bf905","Quantitative headspace (HS) measurements have been performed on the practical industrial and military plastic bonded explosives (PBX) tagged-C-4, Semtex-1A, Semtex-H, detonating cord (detcord), and sheet explosive (Detaflex). The measurements were made by a modified purge and trap technique developed in our laboratory on the basis of cryoadsorption on short alumina-coated porous layer open tubular (PLOT) columns. Trace compounds (of both high and low volatility) were identified and quantitated as a function of HS collection temperature. The data are presented in the form of van't Hoff equations. The linear relationship of the recovered mass as a function of inverse collection temperature reveals the predictive capabilities of the methodology employed here. Knowledge of the compounds that can be detected, along with the expected concentrations to be collected, can aid in detection of explosive materials. Additionally, these data can aid in the standardization, calibration, and certification of energetic material detection devices and can aid in the training of canines for explosive detection. © This article not subject to U.S. Copyright. Published 2010 by the American Chemical Society.","2-s2.0-77954199846"
"10.1039/c0cc02752a","https://www.scopus.com/inward/record.uri?eid=2-s2.0-78651302732&doi=10.1039%2fc0cc02752a&partnerID=40&md5=c6bc96e5ff7f65e128a7e335ff746423","Here we report sensitive and selective detection of TNT based on plasmonic resonance energy transfer from a gold nanoplasmonic probe to conjugated target TNT molecules, leading to quenching on the Rayleigh scattering spectrum of the probe. © 2011 The Royal Society of Chemistry.","2-s2.0-78651302732"
"10.1002/prep.200900084","https://www.scopus.com/inward/record.uri?eid=2-s2.0-78249248972&doi=10.1002%2fprep.200900084&partnerID=40&md5=9c00c3daf80ada5879744d2f9a2d520f","The growing use of explosives by terrorists and criminals creates a need for instrumentation which can rapidly analyze these energetic compounds, preferably on site. Direct analysis in real time (DART) is a promising technology for surface analysis with little or no sample preparation. Therefore, DART ionization is evaluated for use in detecting explosives on solid substrates and in liquid matrices. Fifteen explosives were chosen as a consequence of their common usage. Five surfaces were chosen to represent a wide range of physical properties such as composition, porosity, surface morphology, and thermal and electrical conductivity. Additionally these surfaces are commonly found in everyday surroundings. All 75 compound-surface combinations produced a clear, easily identifiable, mass spectra characteristic of the targeted analyte. Simultaneous detection of five explosives is demonstrated on these same surfaces. Lastly, rapid detection of trace contamination in common fluids is also explored. © 2010 WILEY-VCH Verlag GmbH & Co. KGaA, Weinheim.","2-s2.0-78249248972"
"10.1016/j.theochem.2010.08.022","https://www.scopus.com/inward/record.uri?eid=2-s2.0-77958151758&doi=10.1016%2fj.theochem.2010.08.022&partnerID=40&md5=d64516aca49a3f4d845308fe3d003d0f","A new quantitative method for predicting and calculating the heat of detonation for a series of nitro paraffins and nitramines employing the natural bond orbital (NBO) charge analysis and 15N NMR chemical shifts of the nitro group is established. All calculations, including optimizations, charge analysis and 15NNitro NMR chemical shifts, were performed using density functional (DFT) methods with 6-311+G(d,p) basis set. The results show a linear correlation between the nitro group charges and C/N-nitro bond lengths. The latter reflect the strength of the corresponding bond and thus the stability of the nitro compounds. A strong correlation was observed between the heat of detonation with the charge and 15N NMR chemical shift on the nitro group in nitramines and nitro paraffins. Nitro compounds with a higher heat of detonation have less negative nitro group charges, (QNitro) and a lower value for the 15NNitro chemical shift in analogous compounds. From the quantitative models, the heat of detonation increase when the QNitro values (positive coefficient) are larger and decrease when the 15NNitro NMR chemical shift (negative coefficient) is higher. The present work provides consistent models (mean square error prediction values below 0.14MJkg-1) in a systematic way for quick estimation of heats of detonation - with or without experimental data - for a wide range of energetic materials. This practical approach is particularly useful as a tool for the design of high-energy density materials. © 2010 Elsevier B.V.","2-s2.0-77958151758"
"10.1016/j.jhazmat.2010.07.027","https://www.scopus.com/inward/record.uri?eid=2-s2.0-77956437038&doi=10.1016%2fj.jhazmat.2010.07.027&partnerID=40&md5=859c69ce8872994dd9e41818458c81fe","The frictional properties of single crystals of cyclotetramethylene tetranitramine (HMX), cyclotrimethylene trinitramine (RDX) and pentaerythritol tetranitrate (PETN) secondary explosives are examined using a sensitive friction machine. The explosive crystals used for the measurements are at least 3.5 mm wide. The friction coefficients between crystals of the same explosive (i.e., HMX on HMX, etc.), crystals of different explosives (i.e., HMX on RDX, etc.), and each explosive and a well-polished gauge steel surface are determined. The frictional surfaces are also studied under an environmental scanning electron microscope (ESEM) to analyze surface microstructural changes under increasing loading forces. The friction coefficients vary considerably with increasing normal loading forces and are particularly sensitive to slider shapes, crystal roughness and the mechanical properties of both the slider and the sample. With increasing loading forces, most friction experiments show surface damage, consisting of grooves, debris, and nano-particles, on both the slider and sample. In some cases, a strong evidence of a localized molten state is found in the central region of the friction track. Possible mechanisms that affect the friction coefficient are discussed based on microscopic observations. © 2010 Elsevier B.V.","2-s2.0-77956437038"
"10.1016/j.tca.2011.04.021","https://www.scopus.com/inward/record.uri?eid=2-s2.0-79959689911&doi=10.1016%2fj.tca.2011.04.021&partnerID=40&md5=aac7ba89d48ee4c5a157f291855d773d","Aging and degradation of urea nitrate below the melting point, at 100 °C, was studied by using thermal analysis and spectroscopic methods including IR, Raman, 1H and 13C NMR techniques. It was found that urea nitrate was completely degraded after 72 h at 100 °C into a mixture of solids (69%) and released gaseous species (31%). The degradation mechanism below the melting point was clearly identified. The remaining solid mixture was composed of ammonium nitrate, urea and biuret while unreacted residual nitric and isocyanic acids as well as traces of ammonia were released as gaseous species at 100 °C. The thermal stability of urea nitrate, under extreme storage conditions (50 °C), was also examined by isothermal nano-calorimetry. © 2011 Elsevier B.V. All Reserved rights.","2-s2.0-79959689911"
"10.1016/j.tca.2010.12.021","https://www.scopus.com/inward/record.uri?eid=2-s2.0-79951812722&doi=10.1016%2fj.tca.2010.12.021&partnerID=40&md5=9b448f5b1c34b29d1fdc5da80aa36f9e","PBXN-9, an HMX-formulation, is thermally damaged and thermally decomposed in order to determine the morphological changes and decomposition kinetics that occur in the material after mild to moderate heating. The material and its constituents were decomposed using standard thermal analysis techniques (DSC and TGA) and the decomposition kinetics are reported using different kinetic models. Pressed parts and prill were thermally damaged, i.e. heated to temperatures that resulted in material changes but did not result in significant decomposition or explosion, and analyzed. In general, the thermally damaged samples showed a significant increase in porosity and decrease in density and a small amount of weight loss. These PBXN-9 samples appear to sustain more thermal damage than similar HMX-Viton A formulations and the most likely reasons are the decomposition/evaporation of a volatile plasticizer and a polymorphic transition of the HMX from β to δ phase. © 2011 Elsevier B.V. All rights reserved.","2-s2.0-79951812722"
"10.3109/02652040903367335","https://www.scopus.com/inward/record.uri?eid=2-s2.0-77955448532&doi=10.3109%2f02652040903367335&partnerID=40&md5=3e1dd4d04679faeba5bb256bb0ef7842","Well characterized test materials are essential for validating the performance of current trace explosive detection systems. These test materials must replicate trace explosive contamination in the form of small particles with characteristic diameters in the micrometer range. In this work, Precision Particle Fabrication was used to fabricate monodisperse polymer microspheres that contain high explosives. Three high explosives were successfully incorporated into the microspheres. Ion mobility spectrometry confirmed that the encapsulation efficiency was typically greater than 50%, with some suspected loss to the aqueous phase during production. This study demonstrates that, with this technique, polymer microspheres containing explosives can be produced with sufficient encapsulation, along with tightly controlled particle size distributions at high production rates. These microspheres have proven to be a valuable test material for trace explosive detectors because of their highly precise size, shape and explosive composition. © 2010 Informa UK Ltd All rights reserved.","2-s2.0-77955448532"
"10.1016/j.molstruc.2010.07.036","https://www.scopus.com/inward/record.uri?eid=2-s2.0-77956339609&doi=10.1016%2fj.molstruc.2010.07.036&partnerID=40&md5=f608de88fa848a7e6e04f28480c6f863","3,3-Dinitroazetidinium picrate (DNAZPA) was synthesized by adding 3,3-dinitroazetidine (DNAZ) to picric acid (PA) in methanol, the single crystals suitable for X-ray measurement were obtained by recrystallization at room temperature. The compound crystallises orthorhombic with space group P2 12121 and crystal parameters of a = 0.7655(1) nm, b = 0.8962(2) nm, c = 2.0507(4) nm, V = 1.4069(5) nm3, D c = 1.776 g cm-3, Z = 4, F(0 0 0) = 768 and μ = 0.166 mm-1. The thermal behavior of DNAZPA was studied under a non-isothermal condition by DSC and TG-DTG methods. The kinetic parameters of the first exothermic thermal decomposition process were obtained from analysis of the DSC and TG curves by Kissinger method, Ozawa method and the integral method. The specific heat capacity of DNAZPA was determined with a continuous Cp mode of micro-calorimeter and the standard mole specific heat capacity was 436.56 J mol-1 K-1 at 298.15 K. Using the relationship of Cp with T and the thermal decomposition parameters, the time of the thermal decomposition from initialization to thermal explosion (adiabatic time-to-explosion) was evaluated to be 40.7 s. The free radical signals of DNAZPA and 1,3,3-trinitroazetidine (TNAZ) were detected by electron spin resonance (ESR) technique to estimate its sensitivity. © 2010 Elsevier B.V. All rights reserved.","2-s2.0-77956339609"
"10.1021/ja107419t","https://www.scopus.com/inward/record.uri?eid=2-s2.0-78149236202&doi=10.1021%2fja107419t&partnerID=40&md5=7b0d90580108027727d61982506dd7cd","Triacetone triperoxide (TATP), one of the most dangerous primary explosives, has emerged as an explosive of choice for terrorists in recent years. Owing to the lack of UV absorbance, fluorescence, or facile ionization, TATP is extremely difficult to detect directly. Techniques that are able to detect generally require expensive instrumentation, need extensive sample preparation, or cannot detect TATP in the gas phase. Here we report a simple and highly sensitive colorimetric sensor for the detection of TATP vapor with semiquantitative analysis from 50 ppb to 10 ppm. By using a solid acid catalyst to pretreat a gas stream, we have discovered that a colorimetric sensor array of redox sensitive dyes can detect even very low levels of TATP vapor from its acid decomposition products (e.g., H2O2) with limits of detection (LOD) below 2 ppb (i.e., <0.02% of its saturation vapor pressure). Common potential interferences (e.g., humidity, personal hygiene products, perfume, laundry supplies, volatile organic compounds, etc.) do not generate an array response, and the array can also differentiate TATP from other chemical oxidants (e.g., hydrogen peroxide, bleach, tert-butylhydroperoxide, peracetic acid). © 2010 American Chemical Society.","2-s2.0-78149236202"
"10.1016/j.forsciint.2010.10.017","https://www.scopus.com/inward/record.uri?eid=2-s2.0-79955483161&doi=10.1016%2fj.forsciint.2010.10.017&partnerID=40&md5=96f43c211e56b6f2c83387e333b9486a","Traces of the improvised explosive urea nitrate can be characterized by a sensitive colorimetric reaction with p-dimethylaminocinnamalaldehyde (p-DMAC, UN-1 reagent). As recently shown, the dark red product has a structure of a protonated Schiff base. The unprotonated free base, previously postulated in the literature to be the colored product, was now prepared and fully characterized. It shows totally different spectroscopic properties from the dark red compound. Similarly, the analogous free base of the reaction between urea nitrate and the one-vinyl shorter reagent, p-dimethylaminobenzaldehyde, was synthesized and characterized. Similar differences between the free and protonated forms were observed. The protonated Schiff base spontaneously decomposes to the free base over time.This study provides the missing link in the elucidation of the colorimetric reaction between urea nitrate and UN-1. Both colored products show characteristics of typical acid-base indicators. © 2010 Elsevier Ireland Ltd.","2-s2.0-79955483161"
"10.1016/j.jhazmat.2010.09.058","https://www.scopus.com/inward/record.uri?eid=2-s2.0-78549238502&doi=10.1016%2fj.jhazmat.2010.09.058&partnerID=40&md5=064fd0505259f647f830b0e7e41a154f","Cyclotrimethylenetrinitramine (RDX)-based nanocomposite microparticles were produced by a simple, yet novel spray drying method. The microparticles were characterized by scanning electron microscopy (SEM), transmission electron microscopy (TEM), X-ray diffraction (XRD) and high performance liquid chromatography (HPLC), which shows that they consist of small RDX crystals (∼0.1-1μm) uniformly and discretely dispersed in a binder. The microparticles were subsequently pressed to produce dense energetic materials which exhibited a markedly lower shock sensitivity. The low sensitivity was attributed to small crystal size as well as small void size (∼250 nm). The method developed in this work may be suitable for the preparation of a wide range of insensitive explosive compositions. © 2010 Elsevier B.V.","2-s2.0-78549238502"
