"DOI","Link","Abstract","EID"
"10.1016/j.comptc.2014.12.014","https://www.scopus.com/inward/record.uri?eid=2-s2.0-84920902149&doi=10.1016%2fj.comptc.2014.12.014&partnerID=40&md5=5904e71c2f14814dd56788346fb21db5","The molecular structures of azole substituted tetrazolo[1,5-. b][1,2,4,5]tetrazine (AsTT) derivatives were designed and fully optimized at the B3PW91/6-31G(d,p) level of theory. Isodesmic reaction was constructed to predict gas phase heat of formation (HOF) and heat of sublimation derived from Politzer approach was used to calculate HOF at condensed phase. The presence of nitrogen-rich AsTT backbone is found promising in increasing the HOF values. Politzer approach also extended to predict the densities of these derivatives from the calculated surface electrostatic properties. Kamlet-Jacobs equations were used to calculate detonation performances based on predicted solid phase heats of formation, densities and gaseous detonation products. The charge distribution on molecular surface and free space per molecule in the unit cell were used to analyze the sensitivity. The explosive power and power index were calculated to assess the potential of designed compounds. According to our calculations, the designed AsTT derivatives possess interesting explosive properties and could be the potential addition in high energy materials (HEMs). © 2014 Elsevier B.V.","2-s2.0-84920902149"
"10.1002/prep.201400247","https://www.scopus.com/inward/record.uri?eid=2-s2.0-84924034365&doi=10.1002%2fprep.201400247&partnerID=40&md5=a7f484d6bf3b7d35be27c76dda15bdd1","This paper describes the combustion properties of the amino-substituted guanidinium 4,4′,5,5′-tetranitro-2,2′-biimidazolate (N4BIM) series, including the bis-mono, di and triaminoguanidinium salts. These salts are of interest as propellant ingredient additives, and in particular, the bis-triaminoguanidinium salt of N4BIM displays excellent burn rate and combustion behavior. Our combustion studies have shown that TAGN4-BIM displays a fast burning rate and has the lowest pressure dependence exponent yet measured for a triaminoguanidinium salt. © 2015 Wiley-VCH Verlag GmbH & Co. KGaA.","2-s2.0-84924034365"
"10.1002/prep.201500124","https://www.scopus.com/inward/record.uri?eid=2-s2.0-84958850112&doi=10.1002%2fprep.201500124&partnerID=40&md5=6d0041bb3e382c665dbbc0e699efb9cb","Ammonium nitrate (AN), gunpowder (GP), and an ammonium nitrate gunpowder mixture (AN/GP) were studied for impact sensitivity by four laboratories using the drop hammer apparatus. Bruceton and Neyer methods were used as experimental protocols and for data reduction. The results are presented as 50 % probability of reaction (DH50). For AN, the DH50 values are widely varied among the participants, from sensitive to completely insensitive (limit of the equipment), with no real correlation among results. GP and the AN/GP mixture exhibited much more sensitivity overall and were in some cases within statistical values extrapolated from previous studies of RDX. The variability in results for the AN data is attributed to the difficulty in determining a positive reaction event for AN, as detailed by Neyer experiments and photography during positive reactions. Variability in results for the GP and AN/GP mixtures is attributed to equipment environment and detection criteria. This work was performed by the Integrated Data Collection Analysis (IDCA) program, a multi-laboratory effort to standardize safety testing of improvised or homemade explosives funded by the Department of Homeland Security. © 2016 WILEY-VCH Verlag GmbH & Co. KGaA, Weinheim.","2-s2.0-84958850112"
"10.1039/c5ce02172c","https://www.scopus.com/inward/record.uri?eid=2-s2.0-84973363506&doi=10.1039%2fc5ce02172c&partnerID=40&md5=7a43bb714be71a34e56176961636f9b5","Two novel zinc metal-organic frameworks [Zn3(TPT)2(DMF)2]·0.5HNMe2 (1) and NH2Me2·[Zn(TPT)]·DMF (2) have been synthesized by using Zn(ii) ions and p-terphenyl-3,4′′,5-tricarboxylic acid (H3TPT). The structures of these two MOFs are dependent on the solvents used in the synthetic processes. Compound 1 was synthesized in a mixture of DMF and H2O, while compound 2 was obtained in the presence of DMF and ethanol. The three-dimensional (3D) framework of 1 is constructed by the connection of Zn-carboxylate chains and TPT3- linkers. The structure of 2 can be described as a 3,6-connected network based on the assembly of binuclear zinc clusters and TPT3- ligands. These two MOFs exhibit ligand-based photoluminescence at around 375 nm, as well as high efficiency for the recyclable detection of nitroaromatic explosives. © 2016 The Royal Society of Chemistry.","2-s2.0-84973363506"
"10.1002/prep.201400220","https://www.scopus.com/inward/record.uri?eid=2-s2.0-84932647734&doi=10.1002%2fprep.201400220&partnerID=40&md5=9feb9c2b73c72d0314f730ca9ed26cbc","The targeted high nitrogen energetic material 1-(2H-tetrazol-5-yl)-1,2,4-triazol-5-amine (TzTA) was synthesized from 3-amino-1,2,4-triazole via a two-step procedure using cyanogen bromide and sodium azide. TzTA was prepared in good yields and characterized using analytical (elemental) and spectroscopic (IR, Raman, NMR) techniques. The crystal structure of sulfate salt of the molecule was solved by means of low temperature X-ray crystallography, which showed the co-planarity of the two rings. The sulfate salt of the molecule crystallized in monoclinic system P21/n, with a crystal density of 1.856gâ€‰cm-3. The thermal stability of the molecule was assessed by DSC. The molecule showed excellent thermal stability better than many known nitrogen rich energetic molecules and showed comparable thermal stability with HMX. Non-isothermal kinetics was performed on the molecule to derive the activation energy. Constant volume combustion energy was determined using oxygen bomb calorimeter and back calculated the heat of formation. Preliminary insight on the gas generating capability of the molecule was tested by measuring the dynamic pressure generated inside a closed bomb. Dynamic pressure of an oxygen balanced system (TzTA and ADN) was also measured using the Parr dynamic pressure measurement system. © 2015 WILEY-VCH Verlag GmbH & Co. KGaA, Weinheim.","2-s2.0-84932647734"
"10.1007/s10071-015-0894-9","https://www.scopus.com/inward/record.uri?eid=2-s2.0-84944320707&doi=10.1007%2fs10071-015-0894-9&partnerID=40&md5=2f870783e13c96c30d157a6429b83f4c","A critical aspect of canine explosive detection involves the animal’s ability respond to novel, untrained odors based on prior experience with training odors. In the current study, adult Labrador retrievers (N = 15) were initially trained to discriminate between a rewarded odor (vanillin) and an unrewarded odor (ethanol) by manipulating scented objects with their nose in order to receive a food reward using a canine-adapted discrimination training apparatus. All dogs successfully learned this olfactory discrimination task (≥80 % correct in a mean of 296 trials). Next, dogs were trained on an ammonium nitrate (AN, NH4NO3) olfactory discrimination task [acquired in 60–240 trials, with a mean (±SEM) number of trials to criterion of 120.0 ± 15.6] and then tested for their ability to respond to untrained ammonium- and/or nitrate-containing chemicals as well as variants of AN compounds. Dogs did not respond to sodium nitrate or ammonium sulfate compounds at rates significantly higher than chance (58.8 ± 4.5 and 57.7 ± 3.3 % correct, respectively). Transfer performance to fertilizer-grade AN, AN mixed in Iraqi soil, and AN and flaked aluminum was significantly higher than chance (66.7 ± 3.2, 73.3 ± 4.0, 68.9 ± 4.0 % correct, respectively); however, substantial individual differences were observed. Only 53, 60, and 64 % of dogs had a correct response rate with fertilizer-grade AN, AN and Iraqi soil, and AN and flaked aluminum, respectively, that were greater than chance. Our results suggest that dogs do not readily generalize from AN to similar AN-based odorants at reliable levels desired for explosive detection dogs and that performance varies significantly within Labrador retrievers selected for an explosive detection program. © 2015, Springer-Verlag Berlin Heidelberg.","2-s2.0-84944320707"
"10.1016/j.forsciint.2015.12.034","https://www.scopus.com/inward/record.uri?eid=2-s2.0-84954304736&doi=10.1016%2fj.forsciint.2015.12.034&partnerID=40&md5=eff721f438de6fd33d2a0c4f72bf4b1b","Gas chromatography-electron ionization-mass spectrometry (GC-EI-MS) and physical characteristics data for 726 smokeless reloading powders were analyzed by pairwise comparisons of samples comprising the same product and different products. Pairwise comparisons were restricted to samples having matching kernel shape, color, presence or absence of a perforation and measurements. Discrete results were analyzed for same and different products having matching chemical composition determined from a list of 13 organic components. A continuous score-based likelihood ratio was determined for same and different product comparisons using the Fisher transform of the Pearson correlation between the total ion spectra of the compared samples. Probability distributions for same product and different product comparisons appeared bimodal and were modeled with kernel density distributions. In the discrete and continuous data comparisons, the likelihood ratios for probabilities conditioned on same shape, color, presence/absence of perforation and size were found to provide relatively limited support for either the proposition of same product or different product. Further restricting the pairwise comparisons to samples belonging to the same cluster, as determined by agglomerative hierarchical cluster analysis, provided probability distributions for same product and different product comparisons that were more normal, but did not improve the resulting likelihood ratios. These results inform the forensic analyst regarding the evidentiary value of database search results and direct comparisons of recovered and control samples of smokeless powders. © 2016 Elsevier Ireland Ltd.","2-s2.0-84954304736"
"10.1016/j.nima.2014.12.032","https://www.scopus.com/inward/record.uri?eid=2-s2.0-84939944975&doi=10.1016%2fj.nima.2014.12.032&partnerID=40&md5=0ddf82057e7fb5c70b94c59c629132fc","A system for scanning break-bulk cargo for mobile applications is presented. This combines a 140 kV multi-view, multi-energy X-ray system with 2.5 MeV neutrons. The system uses dual energy X-ray radiography with neutron radiography. The X-ray and neutron systems were designed to be collocated in a mobile environment. Various materials were interrogated with the intent of distinguishing threat materials such as explosives from similar benign materials. In particular, the identification of threats and bengins with nearly identical effective atomic numbers has been demonstrated. © 2014 Elsevier B.V. All rights reserved.","2-s2.0-84939944975"
"10.1063/1.4943034","https://www.scopus.com/inward/record.uri?eid=2-s2.0-84960154293&doi=10.1063%2f1.4943034&partnerID=40&md5=60ece7c21d3acb70eab97f96974331ca","The detection of secondary explosive molecules (e.g., ANTA, FOX-7, and CL-20) using Ag decorated ZnO nanostructures as surface enhanced Raman scattering (SERS) probes is demonstrated. ZnO nanostructures were grown on borosilicate glass substrates by rapid thermal oxidation of metallic Zn films at 500 °C. The oxide nanostructures, including nanosheets and nanowires, emerged over the surface of the Zn film leaving behind the metal residue. We demonstrate that SERS measurements with concentrations as low as 10 μM, of the three explosive molecules ANTA, FOX-7, and CL-20 over ZnO/Ag nanostructures, resulted in enhancement factors of ∼107, ∼107, and ∼104, respectively. These measurements validate the high sensitivity of detection of explosive molecules using Ag decorated ZnO nanostructures as SERS substrates. The Zn metal residue and conditions of annealing play an important role in determining the detection sensitivity. © 2016 AIP Publishing LLC.","2-s2.0-84960154293"
"10.1016/j.talanta.2015.05.052","https://www.scopus.com/inward/record.uri?eid=2-s2.0-84930937020&doi=10.1016%2fj.talanta.2015.05.052&partnerID=40&md5=3d6d4b4f71268fa6bc3ee78e880f1ec8","Abstract The applicability of acid degradation of organic peroxides into hydrogen peroxide in a pneumatically driven flow injection system with chemiluminescence reaction with luminol and Cu2+ as a catalyst (FIA-CL) was investigated for the fast and sensitive detection of organic peroxide explosives (OPEs). The target OPEs included hexamethylene triperoxide diamine (HMTD), triacetone triperoxide (TATP) and methylethyl ketone peroxide (MEKP). Under optimised conditions maximum degradations of 70% and 54% for TATP and HMTD, respectively were achieved at 162 μL min-1, and 9% degradation for MEKP at 180 μL min-1. Flow rates were precisely controlled in this single source pneumatic pressure driven multi-channel FIA system by model experiments on mixing of easily detectable component solutions. The linear range for detection of TATP, HMTD and H2O2 was 1-200 μM (r2=0.98-0.99) at both flow rates, while that for MEKP was 20-200 μM (r2=0.97) at 180 μL min-1. The detection limits (LODs) obtained were 0.5 μM for TATP, HMTD and H2O2 and 10 μM for MEKP. The detection times varied from 1.5 to 3 min in this FIA-CL system. Whilst the LOD for H2O2 was comparable with those reported by other investigators, the LODs and analysis times for TATP and HMTD were superior, and significantly, this is the first time the detection of MEKP has been reported by FIA-CL. © 2015 Elsevier B.V.","2-s2.0-84930937020"
"10.1039/c5ra20347c","https://www.scopus.com/inward/record.uri?eid=2-s2.0-84954289656&doi=10.1039%2fc5ra20347c&partnerID=40&md5=3cb59abbf47c74d63e0973ec02c11eee","Sensitive detection of trace amounts of explosives is significantly imperative in the present scientific world due to security concerns and environmental pollution problems. In this endeavour, carbon and silver nanoparticle impregnated graft polymers of poly(vinylalcohol) and polythiophene are synthesized via a single step free radical polymerization reaction for sensing nitroaromatic compounds via fluorescence measurements. The key role of the conducting nanoparticles is to enhance the π-electron density of the luminescent polymer. These electron rich nanocomposites are successfully utilized for highly selective and ultrasensitive detection of electron deficient nitroaromatic explosives based on a fluorescence quenching method. Quenching efficiencies of the carbon and silver nanocomposites for highly electron deficient picric acid (PA) and 2,4,6-trinitrotoluene (TNT) are found to be 99% and 95% respectively. Mechanistic studies have been further explored in detail and it is observed that in most of the analytes including picric acid, a combination of excited state Forster Resonance Energy Transfer (FRET) and Photoinduced Electron Transfer (PET) leads to quenching of fluorescence. On the other hand, in analytes such as 2,4,6-trinitrotoluene, 1,4-dinitrobenzene and nitrobenzene excited state PET is the only reason behind fluorescence quenching. The detection limits of the carbon and silver nanocomposites are found to be in the nM level. Easy synthesis and scalable production of these materials in bulk quantities ensures their widespread future application in defence and industrial sectors for real time explosive detection. © 2016 The Royal Society of Chemistry.","2-s2.0-84954289656"
"10.1016/j.jenvman.2015.08.007","https://www.scopus.com/inward/record.uri?eid=2-s2.0-84940496711&doi=10.1016%2fj.jenvman.2015.08.007&partnerID=40&md5=70de15892f0caa175012f1e104cb52eb","Co-contamination of explosives and heavy metals (HMs) in soil, particularly army shooting range soil, has received increasing environmental concern due to toxicity and risks to ecological systems. In this study, a subcritical water (SCW) extraction process was used to remediate the explosives-plus-HMs-co-contaminated soil. A quantitative evaluation of explosives in the treated soil, compared with untreated soil, was applied to assess explosive removal. The immobilization of HMs was assessed by toxicity characteristic leaching procedure tests, and by investigating the migration of HMs fractions. The environmental risk of HMs in the soil residue was assessed according to the risk assessment code (RAC) and ecological risk indices (Er and RI). The results indicated that SCW treatment could eliminate the explosives, >99%, during the remediation, while the HM was effectively immobilized. The effect of water temperature on reducing the explosives and the risk of HMs in soil was observed. A marked increase in the non-bioavailable concentration of each HM was observed, and the leaching rate of HMs was decreased by 70-97% after SCW treatment at 250 °C, showing the effective immobilization of HMs. According to the RAC or RI, each tested HM showed no or low risk to the environment after treatment. © 2015 Elsevier Ltd.","2-s2.0-84940496711"
"10.1002/prep.201400056","https://www.scopus.com/inward/record.uri?eid=2-s2.0-84924084636&doi=10.1002%2fprep.201400056&partnerID=40&md5=4bf39dbfd44be0941e2dcb8b07f0e0a1","The diammonium (1) and bishydrazinium (2) salts of 4,4′,5,5′-tetranitro-2,2′-biimidazolate (TNBI) were synthesized and their physical properties as well as predicted explosive performance characteristics are described. These dianionic salts are easily formed in good yields by reaction of TNBI with aqueous solutions of the cationic species. TNBI is synthesized from 2,2′-biimidazole, which is ultimately synthesized by the condensation of aqueous glyoxal with ammonium acetate. The compounds were characterized by NMR spectroscopy, vibrational (FT-IR and Raman) spectroscopy, elemental analysis, thermal analysis (DSC, VTS and calorimetry), and small scale safety testing (impact, friction, ESD). The measured densities and heats of formation are reported. The materials show promise for use in IM explosive and propellant formulations due to the combination of their calculated performances, thermal stability and insensitivity to stimuli. © 2015 Wiley-VCH Verlag GmbH & Co. KGaA.","2-s2.0-84924084636"
"10.1021/acs.est.5b02907","https://www.scopus.com/inward/record.uri?eid=2-s2.0-84944937055&doi=10.1021%2facs.est.5b02907&partnerID=40&md5=05678ed559403fb9241268cc7c0ab309","2,4,6-Trinitrotoluene (TNT) has been used as a military explosive for over a hundred years. Contamination concerns have arisen as a result of manufacturing and use on a large scale; however, despite decades of work addressing TNT contamination in the environment, its fate in marine ecosystems is not fully resolved. Here we examine the cycling and fate of TNT in the coastal marine systems by spiking a marine mesocosm containing seawater, sediments, and macrobiota with isotopically labeled TNT (15N-[TNT]), simultaneously monitoring removal, transformation, mineralization, sorption, and biological uptake over a period of 16 days. TNT degradation was rapid, and we observed accumulation of reduced transformation products dissolved in the water column and in pore waters, sorbed to sediments and suspended particulate matter (SPM), and in the tissues of macrobiota. Bulk δ15N analysis of sediments, SPM, and tissues revealed large quantities of 15N beyond that accounted for in identifiable derivatives. TNT-derived N was also found in the dissolved inorganic N (DIN) pool. Using multivariate statistical analysis and a 15N mass balance approach, we identify the major transformation pathways of TNT, including the deamination of reduced TNT derivatives, potentially promoted by sorption to SPM and oxic surface sediments. © 2015 American Chemical Society.","2-s2.0-84944937055"
"10.1016/j.forsciint.2014.11.024","https://www.scopus.com/inward/record.uri?eid=2-s2.0-84921416602&doi=10.1016%2fj.forsciint.2014.11.024&partnerID=40&md5=e1e58e5ec88bb52a2054798d4fcfa7dd","Ammonium nitrate (AN) is frequently encountered in explosives in forensic casework. It is widely available as fertilizer and easy to implement in explosive devices, for example by mixing it with a fuel. Forensic profiling methods to determine whether material found on a crime scene and material retrieved from a suspect arise from the same source are becoming increasingly important. In this work, we have explored the possibility of using isotopic and elemental profiling to discriminate between different batches of AN. Variations within a production batch, between different batches from the same manufacturer, and between batches from different manufacturers were studied using a total of 103 samples from 19 different fertilizer manufacturers. Isotope-ratio mass spectrometry (IRMS) was used to analyze AN samples for their 15N and 18O isotopic composition. The trace-elemental composition of these samples was studied using inductively coupled plasma-mass spectrometry (ICP-MS). All samples were analyzed for the occurrence of 66 elements. 32 of these elements were useful for the differentiation of AN samples. These include magnesium (Mg), calcium (Ca), iron (Fe) and strontium (Sr). Samples with a similar elemental profile may be differentiated based on their isotopic composition. Linear discriminant analysis (LDA) was used to calculate likelihood ratios and demonstrated the power of combining elemental and isotopic profiling for discrimination between different sources of AN. © 2014 Elsevier Ireland Ltd.","2-s2.0-84921416602"
"10.1016/j.ijms.2014.10.007","https://www.scopus.com/inward/record.uri?eid=2-s2.0-84961340967&doi=10.1016%2fj.ijms.2014.10.007&partnerID=40&md5=5b93dd27d6db9d3c37bd6a69f7ef1e41","Abstract Solvent vapor added to the drift gas in a planar high-field asymmetric waveform ion mobility spectrometer (FAIMS) leads to dramatic shifts to larger CV values while retaining narrow peaks, leading to dramatically increased resolving power (up to ∼140) for a variety of ions including isomeric ions. Here we present studies designed to improve the fundamental understanding of the role of solvent vapor on performance of planar FAIMS, focusing on solvent trends with molecular size and effects of temperature. The studies employ as test compounds the [M - H]- ions of the three positional isomers of phthalic acid and the M- and [M - H]- ions of trinitrotoluene (TNT). The addition of solvent vapor to FAIMS carrier gas has a significant impact on the behavior of the ions inside the FAIMS cell and can impact the overall performance of the cell. We have shown that by comparing a range of solvent vapors (water and C1-C4 alcohols), the magnitude of the effect correlates to the molecular volume of the solvent molecule. This fits well with the model of clustering/declustering of ions with neutral molecules on the time scale of waveform used in FAIMS. We have also shown that with the addition of heat, the effect of the solvent vapor is lessened, as one would expect with the cluster/decluster model. © 2014 Elsevier B.V. All rights reserved.","2-s2.0-84961340967"
"10.1016/j.chemosphere.2015.09.101","https://www.scopus.com/inward/record.uri?eid=2-s2.0-84953792243&doi=10.1016%2fj.chemosphere.2015.09.101&partnerID=40&md5=7b4d99f626ceb59006fd026e840f220b","NTO (3-nitro-1,2,4-triazol-5-one) is one of the new explosive compounds used in insensitive munitions (IM) developed to replace traditional explosives, TNT and RDX. Data on NTO fate and transport is needed to determine its environmental behavior and potential for groundwater contamination. We conducted a series of kinetic and equilibrium batch experiments to characterize the fate of NTO in soils and the effect of soil geochemical properties on NTO-soil interactions. A set of experiments was also conducted using sterilized soils to evaluate the contribution of biodegradation to NTO attenuation. Measured pH values for NTO solutions decreased from 5.98 ± 0.13 to 3.50 ± 0.06 with increase in NTO concentration from 0.78 to 100 mg L-1. Conversely, the pH of soil suspensions was not significantly affected by NTO in this concentration range. NTO experienced minimal adsorption, with measured adsorption coefficients being less than 1 cm3 g-1 for all studied soils. There was a highly significant inverse relationship between the measured NTO adsorption coefficients and soil pH (P = 0.00011), indicating the role of NTO and soil charge in adsorption processes. In kinetic experiments, 1st order transformation rate constant estimates ranged between 0.0004 h-1 and 0.0142 h-1 (equivalent to half-lives of 72 and 2 d, respectively), and correlated positively with organic carbon in the soil. Total attenuation of NTO was higher in untreated versus sterilized samples, suggesting that NTO was being biodegraded. The information presented herein can be used to help evaluate NTO potential for natural attenuation in soils. © 2015 Elsevier Ltd.","2-s2.0-84953792243"
"10.1109/IRMMW-THz.2015.7327469","https://www.scopus.com/inward/record.uri?eid=2-s2.0-84969248217&doi=10.1109%2fIRMMW-THz.2015.7327469&partnerID=40&md5=100936da80dbe8ea172dc80d0ade3b3f","Ultrabroadband spectroscopy is a promising novel approach to overcome two major hurdles which have so far limited the application of THz spectroscopy for security applications: the increased bandwidth enables to record several characteristic spectroscopic features and the technique allows for remote detection. However, for real applications several parameters still have to be optimized. A comprehensive evaluation of the potential of this technique includes for example a detailed study of the generation process in an air plasma. We present some aspects of our joint theoretical and experimental evaluation of the technique for defense and civil security applications. © 2015 IEEE.","2-s2.0-84969248217"
